id,title,content,link,,,,,,,,,,,,,,,,,,,,,,,,,,,,
773,blueimp-md5,Simple library for code syntax highlighting,https://www.bootcdn.cn/blueimp-md5/,,,,,,,,,,,,,,,,,,,,,,,,,,,,
774,rainbow,Intuitive animated traffic graph using webgl. If a graph of nodes and edges with data about traffic volume is provided,,,,,,,,,,,,,,,,,,,,,,,,,,,,,
775,vizceral,LazyLoad is a fast,,,,,,,,,,,,,,,,,,,,,,,,,,,,,
776,vanilla-lazyload,TweenJS is a simple tweening library for use in Javascript. It was developed to integrate well with the EaselJS library,,,,,,,,,,,,,,,,,,,,,,,,,,,,,
777,tweenjs,An Angular module that gives you access to the browsers local storage,https://www.bootcdn.cn/tweenjs/,,,,,,,,,,,,,,,,,,,,,,,,,,,,
778,angular-local-storage,Use external SVG spritemaps in any browser,https://www.bootcdn.cn/angular-local-storage/,,,,,,,,,,,,,,,,,,,,,,,,,,,,
779,svg4everybody,A higher-level wrapper around the Github API.,https://www.bootcdn.cn/svg4everybody/,,,,,,,,,,,,,,,,,,,,,,,,,,,,
780,github-api,A Badass Bootstrap UI Kit based on Material Design,https://www.bootcdn.cn/github-api/,,,,,,,,,,,,,,,,,,,,,,,,,,,,
781,material-kit,JSON for the ES5 era.,https://www.bootcdn.cn/material-kit/,,,,,,,,,,,,,,,,,,,,,,,,,,,,
782,json5,JavaScript library for one-directional scrolling with item based navigation support,https://www.bootcdn.cn/json5/,,,,,,,,,,,,,,,,,,,,,,,,,,,,
783,Sly,Scribbletune is a JavaScript library that helps you construct musical ideas with JavaScript String & Array functions and export them as MIDI files.,https://www.bootcdn.cn/Sly/,,,,,,,,,,,,,,,,,,,,,,,,,,,,
784,scribbletune,A UITableView for the web.,https://www.bootcdn.cn/scribbletune/,,,,,,,,,,,,,,,,,,,,,,,,,,,,
785,infinity,JavaScript implementation of the Web Animations API,https://www.bootcdn.cn/infinity/,,,,,,,,,,,,,,,,,,,,,,,,,,,,
786,web-animations,JavaScript implementations of network transports,, message digests, and various utilities.";"https://www.bootcdn.cn/web-animations/",,,,,,,,,,,,,,,,,,,,,,,,,,
787,forge,A port of the Processing visualization language to JavaScript.,https://www.bootcdn.cn/forge/,,,,,,,,,,,,,,,,,,,,,,,,,,,,
788,processing.js,GSS styling engine,https://www.bootcdn.cn/processing.js/,,,,,,,,,,,,,,,,,,,,,,,,,,,,
789,gss-engine,Simple table with sorting and filtering on AngularJS,https://www.bootcdn.cn/gss-engine/,,,,,,,,,,,,,,,,,,,,,,,,,,,,
790,ng-table,CSS3 PIE JavaScript edition. Enables rendering of common CSS3 decoration properties in Internet Explorer 6-9.,https://www.bootcdn.cn/ng-table/,,,,,,,,,,,,,,,,,,,,,,,,,,,,
791,css3pie,Tree View for Twitter Bootstrap,https://www.bootcdn.cn/css3pie/,,,,,,,,,,,,,,,,,,,,,,,,,,,,
792,bootstrap-treeview,Create objects from reusable,,,,,,,,,,,,,,,,,,,,,,,,,,,,,
793,stampit,Versatile SQL database for browser or node. Handles relational data and nested JSON (noSQL). Export to and import from Excel,,,,,,,,,,,,,,,,,,,,,,,,,,,,,
794,alasql,Differentiable Programming in JavaScript,https://www.bootcdn.cn/alasql/,,,,,,,,,,,,,,,,,,,,,,,,,,,,
795,propel,DOMPurify is a DOM-only,, Opera (15+), Internet Explorer (10+), Firefox and Chrome - as well as almost anything else using Blink or WebKit). DOMPurify is written by security people who have vast background in web attacks and XSS. Fear not.";"https://www.bootcdn.cn/propel/",,,,,,,,,,,,,,,,,,,,,,,,,
796,dompurify,Zero watchers binding directives for AngularJS,https://www.bootcdn.cn/dompurify/,,,,,,,,,,,,,,,,,,,,,,,,,,,,
797,angular-bindonce,A library for arbitrary-precision decimal and non-decimal arithmetic,https://www.bootcdn.cn/angular-bindonce/,,,,,,,,,,,,,,,,,,,,,,,,,,,,
798,bignumber.js,A lighweight CSS library with nice defaults and many plugins to kickstart your projects,https://www.bootcdn.cn/bignumber.js/,,,,,,,,,,,,,,,,,,,,,,,,,,,,
799,picnic,Customizable date (and time) picker. Opt-in UI,,,,,,,,,,,,,,,,,,,,,,,,,,,,,
800,rome,Bootstrap full view calendar,https://www.bootcdn.cn/rome/,,,,,,,,,,,,,,,,,,,,,,,,,,,,
801,bootstrap-calendar,A truly modular frontend framework,https://www.bootcdn.cn/bootstrap-calendar/,,,,,,,,,,,,,,,,,,,,,,,,,,,,
802,mercury,This JavaScript library produces complimentary gradients generated from the top 2 dominant colours in supplied images,https://www.bootcdn.cn/mercury/,,,,,,,,,,,,,,,,,,,,,,,,,,,,
803,grade-js,Graph Drawing Library,https://www.bootcdn.cn/grade-js/,,,,,,,,,,,,,,,,,,,,,,,,,,,,
804,vivagraphjs,Responsive,, fully customizable modal window plugin with declarative configuration and hash tracking.";"https://www.bootcdn.cn/vivagraphjs/",,,,,,,,,,,,,,,,,,,,,,,,,,,
805,remodal,Fast browser fingerprint library. By default uses Murmur hashing and returns a 32bit integer number.,https://www.bootcdn.cn/remodal/,,,,,,,,,,,,,,,,,,,,,,,,,,,,
806,fingerprintjs,Generate word clouds in JavaScript.,https://www.bootcdn.cn/fingerprintjs/,,,,,,,,,,,,,,,,,,,,,,,,,,,,
807,d3-cloud,Asynchronous templates for the browser and server (LinkedIn fork),https://www.bootcdn.cn/d3-cloud/,,,,,,,,,,,,,,,,,,,,,,,,,,,,
808,dustjs-linkedin,The officially supported AngularJS binding for Firebase,https://www.bootcdn.cn/dustjs-linkedin/,,,,,,,,,,,,,,,,,,,,,,,,,,,,
809,angularFire,为移动端web而生,https://www.bootcdn.cn/angularFire/,,,,,,,,,,,,,,,,,,,,,,,,,,,,
810,FrozenUI,A simple Instagram javascript plugin for your website.,https://www.bootcdn.cn/FrozenUI/,,,,,,,,,,,,,,,,,,,,,,,,,,,,
811,instafeed.js,An implementation of task/event based asynchronous pattern.,https://www.bootcdn.cn/instafeed.js/,,,,,,,,,,,,,,,,,,,,,,,,,,,,
812,eventproxy,Triggers classes on HTML elements based on the scroll position. It makes use of requestAnimationFrame so it doesn't jack the users scroll,,,,,,,,,,,,,,,,,,,,,,,,,,,,,
813,ScrollTrigger,A jQuery calendar plugin that uses HTML templates.,https://www.bootcdn.cn/ScrollTrigger/,,,,,,,,,,,,,,,,,,,,,,,,,,,,
814,clndr,jQuery plugin providing a Twitter Bootstrap user interface for managing tags.,https://www.bootcdn.cn/clndr/,,,,,,,,,,,,,,,,,,,,,,,,,,,,
815,bootstrap-tagsinput,A funner,,,,,,,,,,,,,,,,,,,,,,,,,,,,,
816,Dynatable,A wrapper for asynchronous http requests,https://www.bootcdn.cn/Dynatable/,,,,,,,,,,,,,,,,,,,,,,,,,,,,
817,reqwest,A jQuery plugin that offers a simplistic way of implementing Lion OS scrollbars.,https://www.bootcdn.cn/reqwest/,,,,,,,,,,,,,,,,,,,,,,,,,,,,
818,jquery.nanoscroller,An open source icon set with marks in SVG,,,,,,,,,,,,,,,,,,,,,,,,,,,,,
819,open-iconic,Library to assist in creating HTML5 MIDI apps.,https://www.bootcdn.cn/open-iconic/,,,,,,,,,,,,,,,,,,,,,,,,,,,,
820,midi.js,Very lightweight js progress bars (for browsers),https://www.bootcdn.cn/midi.js/,,,,,,,,,,,,,,,,,,,,,,,,,,,,
821,nanobar,gridstack.js is a jQuery plugin for widget layout,https://www.bootcdn.cn/nanobar/,,,,,,,,,,,,,,,,,,,,,,,,,,,,
822,gridstack.js,Interactive diagrams,, flowcharts, orgcharts, UML, BPMN, or business diagrams";"https://www.bootcdn.cn/gridstack.js/",,,,,,,,,,,,,,,,,,,,,,,
823,gojs,JavaScript diagramming library,https://www.bootcdn.cn/gojs/,,,,,,,,,,,,,,,,,,,,,,,,,,,,
824,jointjs,react charting components using the chartjs lib,https://www.bootcdn.cn/jointjs/,,,,,,,,,,,,,,,,,,,,,,,,,,,,
825,react-chartjs,Javascript plugin for laying out elements of varying heights in a column-based grid. It also contains support for filtering and sorting items. A lot of examples are included showing how to use all the available options.,https://www.bootcdn.cn/react-chartjs/,,,,,,,,,,,,,,,,,,,,,,,,,,,,
826,jquery.wookmark,Crafty is a modern component and event based framework for javascript games that targets DOM and canvas.,https://www.bootcdn.cn/jquery.wookmark/,,,,,,,,,,,,,,,,,,,,,,,,,,,,
827,crafty,An object-oriented charting API for d3,https://www.bootcdn.cn/crafty/,,,,,,,,,,,,,,,,,,,,,,,,,,,,
828,dimple,An angular.js wrapper for Chart.js,https://www.bootcdn.cn/dimple/,,,,,,,,,,,,,,,,,,,,,,,,,,,,
829,angular-chart.js,Additional features and components for Bootstrap,https://www.bootcdn.cn/angular-chart.js/,,,,,,,,,,,,,,,,,,,,,,,,,,,,
830,jasny-bootstrap,The timepicker addon adds a timepicker to jQuery UI Datepicker,,,,,,,,,,,,,,,,,,,,,,,,,,,,,
831,jquery-ui-timepicker-addon,Diff & Patch for Javascript objects,https://www.bootcdn.cn/jquery-ui-timepicker-addon/,,,,,,,,,,,,,,,,,,,,,,,,,,,,
832,jsondiffpatch,Angular.JS directives for Moment.JS (timeago alternative),https://www.bootcdn.cn/jsondiffpatch/,,,,,,,,,,,,,,,,,,,,,,,,,,,,
833,angular-moment,Social Buttons for Bootstrap,https://www.bootcdn.cn/angular-moment/,,,,,,,,,,,,,,,,,,,,,,,,,,,,
834,bootstrap-social,Load modules on demand (lazy load) with angularJS,https://www.bootcdn.cn/bootstrap-social/,,,,,,,,,,,,,,,,,,,,,,,,,,,,
835,oclazyload,Asyncronous JavaScript loader and dependency manager,https://www.bootcdn.cn/oclazyload/,,,,,,,,,,,,,,,,,,,,,,,,,,,,
836,script.js,Effortless animation between DOM changes (eg. list reordering) using the FLIP technique.,https://www.bootcdn.cn/script.js/,,,,,,,,,,,,,,,,,,,,,,,,,,,,
837,react-flip-move,Dependency free publish/subscribe library,https://www.bootcdn.cn/react-flip-move/,,,,,,,,,,,,,,,,,,,,,,,,,,,,
838,pubsub-js,Slider view component for Twitter Bootstrap.,https://www.bootcdn.cn/pubsub-js/,,,,,,,,,,,,,,,,,,,,,,,,,,,,
839,bootstrap-slider,A reference client implementation for the playback of MPEG DASH via Javascript and compliant browsers.,https://www.bootcdn.cn/bootstrap-slider/,,,,,,,,,,,,,,,,,,,,,,,,,,,,
840,dashjs,Native CSS search engine,https://www.bootcdn.cn/dashjs/,,,,,,,,,,,,,,,,,,,,,,,,,,,,
841,jets,HTML5 Web Socket implementation powered by Flash.,https://www.bootcdn.cn/jets/,,,,,,,,,,,,,,,,,,,,,,,,,,,,
842,web-socket-js,JavaScript library for reading EXIF image metadata,https://www.bootcdn.cn/web-socket-js/,,,,,,,,,,,,,,,,,,,,,,,,,,,,
843,exif-js,jqGrid is an Ajax-enabled JavaScript control that provides solutions for representing and manipulating tabular data on the web.,https://www.bootcdn.cn/exif-js/,,,,,,,,,,,,,,,,,,,,,,,,,,,,
844,jqgrid,Tooltipster is a jQuery tooltip plugin.,https://www.bootcdn.cn/jqgrid/,,,,,,,,,,,,,,,,,,,,,,,,,,,,
845,tooltipster,Event based JavaScript for the browser,https://www.bootcdn.cn/tooltipster/,,,,,,,,,,,,,,,,,,,,,,,,,,,,
846,EventEmitter,AngularJS directives for Google Maps,https://www.bootcdn.cn/EventEmitter/,,,,,,,,,,,,,,,,,,,,,,,,,,,,
847,angular-google-maps,A JavaScript library that lets you add stories everywhere,https://www.bootcdn.cn/angular-google-maps/,,,,,,,,,,,,,,,,,,,,,,,,,,,,
848,zuck.js,A Script Loader For Your Conditional Builds,https://www.bootcdn.cn/zuck.js/,,,,,,,,,,,,,,,,,,,,,,,,,,,,
849,yepnope,A lightweight WYSIWYG editor,https://www.bootcdn.cn/yepnope/,,,,,,,,,,,,,,,,,,,,,,,,,,,,
850,Trumbowyg,Device detection (phone,, os, versions)";"https://www.bootcdn.cn/Trumbowyg/",,,,,,,,,,,,,,,,,,,,,,,,,,
851,mobile-detect,A jump-start for jQuery plugins development.,https://www.bootcdn.cn/mobile-detect/,,,,,,,,,,,,,,,,,,,,,,,,,,,,
852,jquery-boilerplate,qart.js merge picture and QR code.,https://www.bootcdn.cn/jquery-boilerplate/,,,,,,,,,,,,,,,,,,,,,,,,,,,,
853,qartjs,Runtime type checking for React props and similar objects.,https://www.bootcdn.cn/qartjs/,,,,,,,,,,,,,,,,,,,,,,,,,,,,
854,prop-types,DASH/EME video player library,https://www.bootcdn.cn/prop-types/,,,,,,,,,,,,,,,,,,,,,,,,,,,,
855,shaka-player,Ruby on Rails unobtrusive scripting adapter for jQuery,https://www.bootcdn.cn/shaka-player/,,,,,,,,,,,,,,,,,,,,,,,,,,,,
856,jquery-ujs,An AngularJS UI component that can sort nested lists,,,,,,,,,,,,,,,,,,,,,,,,,,,,,
857,angular-ui-tree,An accessible dialog window library for all humans.,https://www.bootcdn.cn/angular-ui-tree/,,,,,,,,,,,,,,,,,,,,,,,,,,,,
858,Modaal,vue.js wrapper for chart.js,https://www.bootcdn.cn/Modaal/,,,,,,,,,,,,,,,,,,,,,,,,,,,,
859,vue-chartjs,Use React Components in Angular,https://www.bootcdn.cn/vue-chartjs/,,,,,,,,,,,,,,,,,,,,,,,,,,,,
860,ngreact,dygraphs is a fast,,,,,,,,,,,,,,,,,,,,,,,,,,,,,
861,dygraph,MooTools is a compact,,,,,,,,,,,,,,,,,,,,,,,,,,,,,
862,mootools,Format user input to match a specified pattern,https://www.bootcdn.cn/mootools/,,,,,,,,,,,,,,,,,,,,,,,,,,,,
863,formatter.js,JavaScript library enabling SVG icons to morph from one to the other. It implements Material Design's Delightful Details transitions.,https://www.bootcdn.cn/formatter.js/,,,,,,,,,,,,,,,,,,,,,,,,,,,,
864,SVG-Morpheus,jQuery validation engine is a Javascript plugin aimed at the validation of form fields in the browser (IE 6-8,, Opera 10). The plugin provides visually appealing prompts that grab user attention on the subject matter.";"https://www.bootcdn.cn/SVG-Morpheus/",,,,,,,,,,,,,,,,,,,,,,,,,,,
865,jQuery-Validation-Engine,Sanitize untrusted HTML (to prevent XSS) with a configuration specified by a Whitelist,https://www.bootcdn.cn/jQuery-Validation-Engine/,,,,,,,,,,,,,,,,,,,,,,,,,,,,
866,js-xss,A small JavaScript library that decorates the WebSocket API to provide a WebSocket connection that will automatically reconnect if the connection is dropped.,https://www.bootcdn.cn/js-xss/,,,,,,,,,,,,,,,,,,,,,,,,,,,,
867,reconnecting-websocket,Flow.js library implements html5 file upload and provides multiple simultaneous,,,,,,,,,,,,,,,,,,,,,,,,,,,,,
868,flow.js,A minimal,,,,,,,,,,,,,,,,,,,,,,,,,,,,,
869,mini.css,A modular charting library built on D3,https://www.bootcdn.cn/mini.css/,,,,,,,,,,,,,,,,,,,,,,,,,,,,
870,plottable.js,A form input builder and validator for React JS,https://www.bootcdn.cn/plottable.js/,,,,,,,,,,,,,,,,,,,,,,,,,,,,
871,formsy-react,Extended regular expressions,https://www.bootcdn.cn/formsy-react/,,,,,,,,,,,,,,,,,,,,,,,,,,,,
872,xregexp,a graph visualization library using web workers and jQuery,https://www.bootcdn.cn/xregexp/,,,,,,,,,,,,,,,,,,,,,,,,,,,,
873,arbor,regl is a fast functional WebGL framework.,https://www.bootcdn.cn/arbor/,,,,,,,,,,,,,,,,,,,,,,,,,,,,
874,regl,Fast Color Parsing and Manipulation,https://www.bootcdn.cn/regl/,,,,,,,,,,,,,,,,,,,,,,,,,,,,
875,tinycolor,Simple rich text editor,https://www.bootcdn.cn/tinycolor/,,,,,,,,,,,,,,,,,,,,,,,,,,,,
876,hallo.js,HTTP Auth Interceptor Module for AngularJS.,https://www.bootcdn.cn/hallo.js/,,,,,,,,,,,,,,,,,,,,,,,,,,,,
877,angular-http-auth,create social share buttons on your site.,https://www.bootcdn.cn/angular-http-auth/,,,,,,,,,,,,,,,,,,,,,,,,,,,,
878,social-share.js,Best-of-breed templating in browser or on Node.js (with Express 4,,,,,,,,,,,,,,,,,,,,,,,,,,,,,
879,jsrender,FlipClock.js is a proper abstract object oriented clock and counter library with a realistic flip effect.,https://www.bootcdn.cn/jsrender/,,,,,,,,,,,,,,,,,,,,,,,,,,,,
880,flipclock,A simple isometric graphics library for HTML5 canvas,https://www.bootcdn.cn/flipclock/,,,,,,,,,,,,,,,,,,,,,,,,,,,,
881,isomer,A jQuery UI plugin to handle multi-tag fields as well as tag suggestions/autocomplete.,https://www.bootcdn.cn/isomer/,,,,,,,,,,,,,,,,,,,,,,,,,,,,
882,tag-it,A simple library to view large images up close using simple mouse interaction,,,,,,,,,,,,,,,,,,,,,,,,,,,,,
883,intense-images,The ultimate JavaScript string library,https://www.bootcdn.cn/intense-images/,,,,,,,,,,,,,,,,,,,,,,,,,,,,
884,voca,A lightweight pure JavaScript script for lazy loading and multi-serving images.,https://www.bootcdn.cn/voca/,,,,,,,,,,,,,,,,,,,,,,,,,,,,
885,blazy,The jQuery plugin for supercool scroll animation,https://www.bootcdn.cn/blazy/,,,,,,,,,,,,,,,,,,,,,,,,,,,,
886,SuperScrollorama,A native Vue.js select component that provides similar functionality to Select2/Chosen without the overhead of jQuery.,https://www.bootcdn.cn/SuperScrollorama/,,,,,,,,,,,,,,,,,,,,,,,,,,,,
887,vue-select,Pub/Sub library providing wildcard subscriptions,,,,,,,,,,,,,,,,,,,,,,,,,,,,,
888,postal.js,a CSS Framework based on material design,https://www.bootcdn.cn/postal.js/,,,,,,,,,,,,,,,,,,,,,,,,,,,,
889,mdui,Salesforce Lightning Design System,https://www.bootcdn.cn/mdui/,,,,,,,,,,,,,,,,,,,,,,,,,,,,
890,design-system,Data entry can be beautiful,https://www.bootcdn.cn/design-system/,,,,,,,,,,,,,,,,,,,,,,,,,,,,
891,gridforms,A jQuery Tokenizing Autocomplete Text Entry,https://www.bootcdn.cn/gridforms/,,,,,,,,,,,,,,,,,,,,,,,,,,,,
892,jquery-tokeninput,MelonJS Game Engine,https://www.bootcdn.cn/jquery-tokeninput/,,,,,,,,,,,,,,,,,,,,,,,,,,,,
893,melonjs,A tiny requestAnimationFrame powered 60+fps lightweight parallax tilt effect for jQuery.,https://www.bootcdn.cn/melonjs/,,,,,,,,,,,,,,,,,,,,,,,,,,,,
894,tilt.js,An arbitrary-precision Decimal type for JavaScript.,https://www.bootcdn.cn/tilt.js/,,,,,,,,,,,,,,,,,,,,,,,,,,,,
895,decimal.js,localStorage and sessionStorage done right for AngularJS.,https://www.bootcdn.cn/decimal.js/,,,,,,,,,,,,,,,,,,,,,,,,,,,,
896,ngStorage,PreloadJS makes it easy to preload your assets: images,, JSON, and text data";"https://www.bootcdn.cn/ngStorage/",,,,,,,,,,,,,,,,,,,,,,,,,,
897,PreloadJS,A nest backgroud of website draw on canvas use javascript,,,,,,,,,,,,,,,,,,,,,,,,,,,,,
898,canvas-nest.js,Lightweight JavaScript form validation library inspired by CodeIgniter.,https://www.bootcdn.cn/canvas-nest.js/,,,,,,,,,,,,,,,,,,,,,,,,,,,,
899,validate-js,Get and set relations (one-to-one,,,,,,,,,,,,,,,,,,,,,,,,,,,,,
900,backbone-relational,JavaScript Computer Vision library,https://www.bootcdn.cn/backbone-relational/,,,,,,,,,,,,,,,,,,,,,,,,,,,,
901,jsfeat,Griddle - A fast and flexible grid component for React.,https://www.bootcdn.cn/jsfeat/,,,,,,,,,,,,,,,,,,,,,,,,,,,,
902,griddle-react,Provides Beautiful Animated Marker Clustering functionality for Leaflet,https://www.bootcdn.cn/griddle-react/,,,,,,,,,,,,,,,,,,,,,,,,,,,,
903,leaflet.markercluster,Lightweight cascading grid layout library,https://www.bootcdn.cn/leaflet.markercluster/,,,,,,,,,,,,,,,,,,,,,,,,,,,,
904,bricklayer,JsBarcode is a simple and powerfull way to create different types of 1d barcodes.,https://www.bootcdn.cn/bricklayer/,,,,,,,,,,,,,,,,,,,,,,,,,,,,
905,jsbarcode,Dynamic pie charts in your favicon,https://www.bootcdn.cn/jsbarcode/,,,,,,,,,,,,,,,,,,,,,,,,,,,,
906,piecon,HTML Inspector is a code quality tool to help you and your team write better markup. It's written in JavaScript and runs in the browser,,,,,,,,,,,,,,,,,,,,,,,,,,,,,
907,html-inspector,A lightweight scroll animation javascript library without any dependency.,https://www.bootcdn.cn/html-inspector/,,,,,,,,,,,,,,,,,,,,,,,,,,,,
908,moveTo,Client-side library for creating dropdowns,https://www.bootcdn.cn/moveTo/,,,,,,,,,,,,,,,,,,,,,,,,,,,,
909,tether-drop,An interface component to give your site/app Medium.com style commenting.,https://www.bootcdn.cn/tether-drop/,,,,,,,,,,,,,,,,,,,,,,,,,,,,
910,side-comments,script.aculo.us provides you with easy-to-use,,,,,,,,,,,,,,,,,,,,,,,,,,,,,
911,scriptaculous,Themeable HTML5 progress bar library,https://www.bootcdn.cn/scriptaculous/,,,,,,,,,,,,,,,,,,,,,,,,,,,,
912,progress.js,Automatically persist your forms' text and select field values locally,,,,,,,,,,,,,,,,,,,,,,,,,,,,,
913,garlic.js,A lightweight,,,,,,,,,,,,,,,,,,,,,,,,,,,,,
914,mobi.css,Pressure is a lightweight JavaScript library for both Force Touch and 3D Touch through a single API.,https://www.bootcdn.cn/mobi.css/,,,,,,,,,,,,,,,,,,,,,,,,,,,,
915,pressure,Enables easy Google map + overlays creation,https://www.bootcdn.cn/pressure/,,,,,,,,,,,,,,,,,,,,,,,,,,,,
916,gmaps4rails,Redux bindings for React Router — keep your router state inside your Redux Store.,https://www.bootcdn.cn/gmaps4rails/,,,,,,,,,,,,,,,,,,,,,,,,,,,,
917,redux-router,Create complex forms from a JSON schema with angular.,https://www.bootcdn.cn/redux-router/,,,,,,,,,,,,,,,,,,,,,,,,,,,,
918,angular-schema-form,A user-friendly HTML5 Form validator for Bootstrap 3,https://www.bootcdn.cn/angular-schema-form/,,,,,,,,,,,,,,,,,,,,,,,,,,,,
919,1000hz-bootstrap-validator,Simple one-to-one WebRTC video/voice and data channels,https://www.bootcdn.cn/1000hz-bootstrap-validator/,,,,,,,,,,,,,,,,,,,,,,,,,,,,
920,simple-peer,The jQuery Plugin for Big Background Video (and Images),https://www.bootcdn.cn/simple-peer/,,,,,,,,,,,,,,,,,,,,,,,,,,,,
921,BigVideo.js,A three dimensional and space effecient menu,https://www.bootcdn.cn/BigVideo.js/,,,,,,,,,,,,,,,,,,,,,,,,,,,,
922,meny,A javascript library providing cross-browser,,,,,,,,,,,,,,,,,,,,,,,,,,,,,
923,easyXDM,AngularJS directive which takes JSON representing a form and renders to HTML,https://www.bootcdn.cn/easyXDM/,,,,,,,,,,,,,,,,,,,,,,,,,,,,
924,angular-formly,UI library for manipulating lists via swipe and drag gestures,https://www.bootcdn.cn/angular-formly/,,,,,,,,,,,,,,,,,,,,,,,,,,,,
925,slipjs,A swipeable cards interface. The swipe-left/swipe-right for yes/no input. As seen in apps like Jelly and Tinder.,https://www.bootcdn.cn/slipjs/,,,,,,,,,,,,,,,,,,,,,,,,,,,,
926,swing,The Quill rich-text editor as a React component.,https://www.bootcdn.cn/swing/,,,,,,,,,,,,,,,,,,,,,,,,,,,,
927,react-quill,Intuitive cookie manipulation library,https://www.bootcdn.cn/react-quill/,,,,,,,,,,,,,,,,,,,,,,,,,,,,
928,cookiesjs,tablesorter (FORK) is a jQuery plugin for turning a standard HTML table with THEAD and TBODY tags into a sortable table without page refreshes. tablesorter can successfully parse and sort many types of data including linked data in a cell.,https://www.bootcdn.cn/cookiesjs/,,,,,,,,,,,,,,,,,,,,,,,,,,,,
929,jquery.tablesorter,Dead simple CSS framework.,https://www.bootcdn.cn/jquery.tablesorter/,,,,,,,,,,,,,,,,,,,,,,,,,,,,
930,hack,Make a beautiful embeddable booking widget in minutes,https://www.bootcdn.cn/hack/,,,,,,,,,,,,,,,,,,,,,,,,,,,,
931,booking-js,AngularUI - The companion suite for AngularJS,https://www.bootcdn.cn/booking-js/,,,,,,,,,,,,,,,,,,,,,,,,,,,,
932,angular-ui,A vanilla JS customisable text input/select box plugin,https://www.bootcdn.cn/angular-ui/,,,,,,,,,,,,,,,,,,,,,,,,,,,,
933,choices.js,Skel: A lightweight responsive framework for the www.,https://www.bootcdn.cn/choices.js/,,,,,,,,,,,,,,,,,,,,,,,,,,,,
934,skel,Play back HLS with video.js,,,,,,,,,,,,,,,,,,,,,,,,,,,,,
935,videojs-contrib-hls,A plugin for jQuery. Make your form controls look how you want them to.,https://www.bootcdn.cn/videojs-contrib-hls/,,,,,,,,,,,,,,,,,,,,,,,,,,,,
936,Uniform.js,Library to convert between lat/lng and OLC codes,https://www.bootcdn.cn/Uniform.js/,,,,,,,,,,,,,,,,,,,,,,,,,,,,
937,openlocationcode,A JavaScript library for rendering music notation and guitar tablature,https://www.bootcdn.cn/openlocationcode/,,,,,,,,,,,,,,,,,,,,,,,,,,,,
938,vexflow,A jQuery Masonry alternative with CSS-driven configuration,https://www.bootcdn.cn/vexflow/,,,,,,,,,,,,,,,,,,,,,,,,,,,,
939,salvattore,Determine later (or previous) occurrences of recurring schedules,https://www.bootcdn.cn/salvattore/,,,,,,,,,,,,,,,,,,,,,,,,,,,,
940,later,Write better assertions,https://www.bootcdn.cn/later/,,,,,,,,,,,,,,,,,,,,,,,,,,,,
941,expect,OpenType font parser,https://www.bootcdn.cn/expect/,,,,,,,,,,,,,,,,,,,,,,,,,,,,
942,opentype.js,jQuery Tags Input Plugin,https://www.bootcdn.cn/opentype.js/,,,,,,,,,,,,,,,,,,,,,,,,,,,,
943,jquery-tagsinput,A flexible,,,,,,,,,,,,,,,,,,,,,,,,,,,,,
944,backbone-forms,Validator component for Vue.js,https://www.bootcdn.cn/backbone-forms/,,,,,,,,,,,,,,,,,,,,,,,,,,,,
945,vue-validator,JS library to generate random pleasing colors/color schemes,https://www.bootcdn.cn/vue-validator/,,,,,,,,,,,,,,,,,,,,,,,,,,,,
946,pleasejs,A lightweight 3D physics engine written in JavaScript.,https://www.bootcdn.cn/pleasejs/,,,,,,,,,,,,,,,,,,,,,,,,,,,,
947,cannon.js,Normalize browsers' default style,https://www.bootcdn.cn/cannon.js/,,,,,,,,,,,,,,,,,,,,,,,,,,,,
948,modern-normalize,The best jQuery plugin for app look-alike on- and off-canvas menus with sliding submenus for your website and webapp.,https://www.bootcdn.cn/modern-normalize/,,,,,,,,,,,,,,,,,,,,,,,,,,,,
949,jQuery.mmenu,A library for pretty shadows.,https://www.bootcdn.cn/jQuery.mmenu/,,,,,,,,,,,,,,,,,,,,,,,,,,,,
950,shine.js,A platform detection library that works on nearly all JavaScript platforms.,https://www.bootcdn.cn/shine.js/,,,,,,,,,,,,,,,,,,,,,,,,,,,,
951,platform,A powerful little tool for managing CSS animations,https://www.bootcdn.cn/platform/,,,,,,,,,,,,,,,,,,,,,,,,,,,,
952,animo.js,slimScroll is a small jQuery plugin that transforms any div into a scrollable area. slimScroll doesn't occupy any visual space as it only appears on a user initiated mouse-over.,https://www.bootcdn.cn/animo.js/,,,,,,,,,,,,,,,,,,,,,,,,,,,,
953,jQuery-slimScroll,jQuery Raty - A Star Rating Plugin,https://www.bootcdn.cn/jQuery-slimScroll/,,,,,,,,,,,,,,,,,,,,,,,,,,,,
954,raty,Google-styled theme for Bootstrap.,https://www.bootcdn.cn/raty/,,,,,,,,,,,,,,,,,,,,,,,,,,,,
955,todc-bootstrap,Touch enabled minimalistic slider written in vanilla JavaScript.,https://www.bootcdn.cn/todc-bootstrap/,,,,,,,,,,,,,,,,,,,,,,,,,,,,
956,lory.js,A suite of react components,https://www.bootcdn.cn/lory.js/,,,,,,,,,,,,,,,,,,,,,,,,,,,,
957,rsuite,jScrollPane - cross browser styleable scrollbars with jQuery and CSS,https://www.bootcdn.cn/rsuite/,,,,,,,,,,,,,,,,,,,,,,,,,,,,
958,jScrollPane,A CSS grid framework using Flexbox.,https://www.bootcdn.cn/jScrollPane/,,,,,,,,,,,,,,,,,,,,,,,,,,,,
959,grd,Fast text replacement with canvas and VML - no Flash or images required.,https://www.bootcdn.cn/grd/,,,,,,,,,,,,,,,,,,,,,,,,,,,,
960,cufon,Show some HTML before visitors leave your site.,https://www.bootcdn.cn/cufon/,,,,,,,,,,,,,,,,,,,,,,,,,,,,
961,ouibounce,The jQuery Mockjax Plugin provides a simple and extremely flexible interface for mocking or simulating ajax requests and responses.,https://www.bootcdn.cn/ouibounce/,,,,,,,,,,,,,,,,,,,,,,,,,,,,
962,jquery-mockjax,Algolia theme for React InstantSearch,https://www.bootcdn.cn/jquery-mockjax/,,,,,,,,,,,,,,,,,,,,,,,,,,,,
