id,title,content,link,,,,,,,,,,,,,,,,,,,,,,,,,,,,
2621,videojs-markers,Bootstrap3 style for typeahead.js using Bootstrap 3 mixins and variables,https://www.bootcdn.cn/videojs-markers/,,,,,,,,,,,,,,,,,,,,,,,,,,,,
2622,typeahead.js-bootstrap-css,Finally a dropdown plugin that transforms select inputs in nice dropdowns and does not drive you crazy.,https://www.bootcdn.cn/typeahead.js-bootstrap-css/,,,,,,,,,,,,,,,,,,,,,,,,,,,,
2623,dropdown.js,A simple and light weight circular indicator / progressbar plugin.,https://www.bootcdn.cn/dropdown.js/,,,,,,,,,,,,,,,,,,,,,,,,,,,,
2624,radialIndicator,A parser and formatter for delimiter-separated values,,,,,,,,,,,,,,,,,,,,,,,,,,,,,
2625,d3-dsv,Converts character encoding.,https://www.bootcdn.cn/d3-dsv/,,,,,,,,,,,,,,,,,,,,,,,,,,,,
2626,encoding-japanese,A npm package for easy downloading of ZingChart.,https://www.bootcdn.cn/encoding-japanese/,,,,,,,,,,,,,,,,,,,,,,,,,,,,
2627,zingchart,A powerful search suggestion input box.,https://www.bootcdn.cn/zingchart/,,,,,,,,,,,,,,,,,,,,,,,,,,,,
2628,unibox,A request library that returns promises,,,,,,,,,,,,,,,,,,,,,,,,,,,,,
2629,then-request,The μ framework is just 1 kb. Inspired by the motherfuckingwebsite.com,,,,,,,,,,,,,,,,,,,,,,,,,,,,,
2630,mu,easy-to-use tooltips for Flot charts,https://www.bootcdn.cn/mu/,,,,,,,,,,,,,,,,,,,,,,,,,,,,
2631,flot.tooltip,A small jQuery plugin that turns an input field into a highly customizable rating component,https://www.bootcdn.cn/flot.tooltip/,,,,,,,,,,,,,,,,,,,,,,,,,,,,
2632,bootstrap-rating,Hammer.js support for Angular.js applications,https://www.bootcdn.cn/bootstrap-rating/,,,,,,,,,,,,,,,,,,,,,,,,,,,,
2633,RyanMullins-angular-hammer,jQuery plugin that make tables responsive,https://www.bootcdn.cn/RyanMullins-angular-hammer/,,,,,,,,,,,,,,,,,,,,,,,,,,,,
2634,ReStable,Drag & drop hierarchical list with mouse and touch compatibility,https://www.bootcdn.cn/ReStable/,,,,,,,,,,,,,,,,,,,,,,,,,,,,
2635,nestable2,jqPlot is a plotting and charting plugin for the jQuery Javascript framework. jqPlot produces beautiful line,,,,,,,,,,,,,,,,,,,,,,,,,,,,,
2636,jqPlot,Super-seeded by github.com/balupton/history.js - jQuery History allows you to easily track changes of the pages state by tracking URL Hashes. Supports changes triggered by bookmarks and back & forward buttons,,,,,,,,,,,,,,,,,,,,,,,,,,,,,
2637,balupton-jquery-history,Simple Event Controller for Riot.js,,,,,,,,,,,,,,,,,,,,,,,,,,,,,
2638,riotux,Deals with overlapping markers in the Leaflet maps API,,,,,,,,,,,,,,,,,,,,,,,,,,,,,
2639,OverlappingMarkerSpiderfier-Leaflet,A centralized state management for Javascript applications,,,,,,,,,,,,,,,,,,,,,,,,,,,,,
2640,mockstate,This script allows smooth cross-browser customization of form elements with CSS,https://www.bootcdn.cn/mockstate/,,,,,,,,,,,,,,,,,,,,,,,,,,,,
2641,jcf,Compute the Voronoi diagram of a set of two-dimensional points.,https://www.bootcdn.cn/jcf/,,,,,,,,,,,,,,,,,,,,,,,,,,,,
2642,d3-voronoi,Simple HTML5 charts using the canvas element.,https://www.bootcdn.cn/d3-voronoi/,,,,,,,,,,,,,,,,,,,,,,,,,,,,
2643,chartjs-plugin-zoom,An AAC decoder for Aurora.js,https://www.bootcdn.cn/chartjs-plugin-zoom/,,,,,,,,,,,,,,,,,,,,,,,,,,,,
2644,aurora.js-aac,An angular directive for seiyria-bootstrap-slider,https://www.bootcdn.cn/aurora.js-aac/,,,,,,,,,,,,,,,,,,,,,,,,,,,,
2645,angular-bootstrap-slider,Chromecast plugin for videojs,https://www.bootcdn.cn/angular-bootstrap-slider/,,,,,,,,,,,,,,,,,,,,,,,,,,,,
2646,video.js-chromecast,jQuery for Opal,https://www.bootcdn.cn/video.js-chromecast/,,,,,,,,,,,,,,,,,,,,,,,,,,,,
2647,opal-jquery,Angular directive for rich text editor Quill,https://www.bootcdn.cn/opal-jquery/,,,,,,,,,,,,,,,,,,,,,,,,,,,,
2648,ng-quill,Animated scrolling of series with jQuery,https://www.bootcdn.cn/ng-quill/,,,,,,,,,,,,,,,,,,,,,,,,,,,,
2649,jquery.serialScroll,A jQuery plugin for selecting a country,https://www.bootcdn.cn/jquery.serialScroll/,,,,,,,,,,,,,,,,,,,,,,,,,,,,
2650,country-select-js,selection text/caret operation - jQuery pulgin | 選択範囲のテキスト操作 / キャレット操作,https://www.bootcdn.cn/country-select-js/,,,,,,,,,,,,,,,,,,,,,,,,,,,,
2651,jquery.selection,A JavaScript micro-framework for adding drag-and-drop functionality to elements for advanced UI development,https://www.bootcdn.cn/jquery.selection/,,,,,,,,,,,,,,,,,,,,,,,,,,,,
2652,DragDrop,The official client module for Cosmic JS. This module helps you easily add dynamic content to your website or application.,https://www.bootcdn.cn/DragDrop/,,,,,,,,,,,,,,,,,,,,,,,,,,,,
2653,cosmicjs,A build of AngularJS 1.3 with polyfils and some changes to bring back IE8 compatibilty,https://www.bootcdn.cn/cosmicjs/,,,,,,,,,,,,,,,,,,,,,,,,,,,,
2654,angularjs-ie8-build,clouda event and gesture lib touch.js,https://www.bootcdn.cn/angularjs-ie8-build/,,,,,,,,,,,,,,,,,,,,,,,,,,,,
2655,touchjs,Nifty scroll events for jQuery.,https://www.bootcdn.cn/touchjs/,,,,,,,,,,,,,,,,,,,,,,,,,,,,
2656,jquery.scrollex,Pan and zoom SVG,,,,,,,,,,,,,,,,,,,,,,,,,,,,,
2657,d3-zoom,Color spaces! RGB,,,,,,,,,,,,,,,,,,,,,,,,,,,,,
2658,d3-color,Automatically add vendor prefixes,https://www.bootcdn.cn/d3-color/,,,,,,,,,,,,,,,,,,,,,,,,,,,,
2659,css3finalize,A quick full rewrite of jquery address picker plugin,,,,,,,,,,,,,,,,,,,,,,,,,,,,,
2660,typeahead-addresspicker,Unobtrusive Google Maps animated marker,https://www.bootcdn.cn/typeahead-addresspicker/,,,,,,,,,,,,,,,,,,,,,,,,,,,,
2661,marker-animate-unobtrusive,A JavaScript key state handler for web apps,https://www.bootcdn.cn/marker-animate-unobtrusive/,,,,,,,,,,,,,,,,,,,,,,,,,,,,
2662,keydrown,Float a number of things up on a page (hearts,,,,,,,,,,,,,,,,,,,,,,,,,,,,,
2663,floating.js,A JavaScript implementation of Behavior Trees. They are useful for implementing AIs. For Browsers and NodeJS.,https://www.bootcdn.cn/floating.js/,,,,,,,,,,,,,,,,,,,,,,,,,,,,
2664,behaviortree,Easily render backbone.js collections with support for automatic selection of models in response to clicks,,,,,,,,,,,,,,,,,,,,,,,,,,,,,
2665,backbone.collectionView,The Validator is cross-browser and will give you the power to use future-proof input types such as 'tel',, and 'url'. I can sum this as a 'template' for creating web forms. It uses the power of custom 'data' to achieve high flexibility";"https://www.bootcdn.cn/backbone.collectionView/",,,,,,,,,,,,,,,,,,,,,,,,,,,
2666,yairEO-validator,W3C UserTiming polyfill,https://www.bootcdn.cn/yairEO-validator/,,,,,,,,,,,,,,,,,,,,,,,,,,,,
2667,usertiming,Http Adaptive Streaming javascript player based on HTML5 premium extensions (MSE/EME),https://www.bootcdn.cn/usertiming/,,,,,,,,,,,,,,,,,,,,,,,,,,,,
2668,hasplayer.js,SoundManager2 Music Player for AngularJs,https://www.bootcdn.cn/hasplayer.js/,,,,,,,,,,,,,,,,,,,,,,,,,,,,
2669,angular-soundmanager2,Default bootstrap checkbox toggle buttons. Just default Bootstrap,, Chrome, Safari Ios, Stock Android browser 4.2, Chrome Android";"https://www.bootcdn.cn/angular-soundmanager2/",,,,,,,,,,,,,,,,,,,,,,,,
2670,titatoggle,A lightbox wrapper for Ken's amazing slick carousel,https://www.bootcdn.cn/titatoggle/,,,,,,,,,,,,,,,,,,,,,,,,,,,,
2671,slick-lightbox,There really should be a conclusive JavaScript weather library.,https://www.bootcdn.cn/slick-lightbox/,,,,,,,,,,,,,,,,,,,,,,,,,,,,
2672,weather,Vue.js component for bootstrap-datetimepicker,https://www.bootcdn.cn/weather/,,,,,,,,,,,,,,,,,,,,,,,,,,,,
2673,vue-bootstrap-datetimepicker,A simple SHA-3 / Keccak / Shake hash function for JavaScript supports UTF-8 encoding.,https://www.bootcdn.cn/vue-bootstrap-datetimepicker/,,,,,,,,,,,,,,,,,,,,,,,,,,,,
2674,js-sha3,Annotations for Chart.js,https://www.bootcdn.cn/js-sha3/,,,,,,,,,,,,,,,,,,,,,,,,,,,,
2675,chartjs-plugin-annotation,Radian is a JavaScript library for producing interactive SVG plots in HTML using Angular JS and D3.js.,https://www.bootcdn.cn/chartjs-plugin-annotation/,,,,,,,,,,,,,,,,,,,,,,,,,,,,
2676,Radian,Client side image cropper directive for AngularJS (rectangular area,,,,,,,,,,,,,,,,,,,,,,,,,,,,,
2677,angular-img-cropper,jQuery plugin for bootstrap panels. It extends panels with several common and useful functions.,https://www.bootcdn.cn/angular-img-cropper/,,,,,,,,,,,,,,,,,,,,,,,,,,,,
2678,lobipanel,get the visitor's attention,https://www.bootcdn.cn/lobipanel/,,,,,,,,,,,,,,,,,,,,,,,,,,,,
2679,jquery-twinkle,Easy use of morris.js with angular.js,https://www.bootcdn.cn/jquery-twinkle/,,,,,,,,,,,,,,,,,,,,,,,,,,,,
2680,angular-morris,TextHighlighter allows you to highlight text on web pages.,https://www.bootcdn.cn/angular-morris/,,,,,,,,,,,,,,,,,,,,,,,,,,,,
2681,texthighlighter,Highlight.js line numbers plugin.,https://www.bootcdn.cn/texthighlighter/,,,,,,,,,,,,,,,,,,,,,,,,,,,,
2682,highlightjs-line-numbers.js,A jQuery plugin to size text such that it completely fills its container.,https://www.bootcdn.cn/highlightjs-line-numbers.js/,,,,,,,,,,,,,,,,,,,,,,,,,,,,
2683,squishy,An AMD loader plugin for detecting DOM ready,https://www.bootcdn.cn/squishy/,,,,,,,,,,,,,,,,,,,,,,,,,,,,
2684,require-domReady,Responsive and lightweight Slider plugin for jQuery / Zepto,https://www.bootcdn.cn/require-domReady/,,,,,,,,,,,,,,,,,,,,,,,,,,,,
2685,PgwSlider,Simple plugin for Leaflet that adds fullscreen button to your maps.,https://www.bootcdn.cn/PgwSlider/,,,,,,,,,,,,,,,,,,,,,,,,,,,,
2686,leaflet.fullscreen,jQuery Easy ticker plugin,https://www.bootcdn.cn/leaflet.fullscreen/,,,,,,,,,,,,,,,,,,,,,,,,,,,,
2687,jquery-easy-ticker,Bulletproof CSS-only implementation of Float Label pattern with automatic fallback for ANY non-supporting browser.,https://www.bootcdn.cn/jquery-easy-ticker/,,,,,,,,,,,,,,,,,,,,,,,,,,,,
2688,float-label-css,FeedEk is a jQuery plugin for parsing and displaying RSS and Atom feeds. FeedEk uses YQL API to retrieve feeds. You can obtain feeds easily from any domain. No need for server-side scripts.,https://www.bootcdn.cn/float-label-css/,,,,,,,,,,,,,,,,,,,,,,,,,,,,
2689,FeedEk,a JS to CSS transformer,https://www.bootcdn.cn/FeedEk/,,,,,,,,,,,,,,,,,,,,,,,,,,,,
2690,restyle,Leaflet plugin to search (geocode) using Mapzen Search or your own hosted version of the Pelias Geocoder API.,https://www.bootcdn.cn/restyle/,,,,,,,,,,,,,,,,,,,,,,,,,,,,
2691,leaflet-geocoder-mapzen,JQuery Web Ticker,https://www.bootcdn.cn/leaflet-geocoder-mapzen/,,,,,,,,,,,,,,,,,,,,,,,,,,,,
2692,jquery.webticker,Enhances standard form input fields helping users to select (or type) times.,https://www.bootcdn.cn/jquery.webticker/,,,,,,,,,,,,,,,,,,,,,,,,,,,,
2693,timepicker,Add-on to jQuery Validation to enable unobtrusive validation options in data-* attributes.,https://www.bootcdn.cn/timepicker/,,,,,,,,,,,,,,,,,,,,,,,,,,,,
2694,jquery-validation-unobtrusive,Turn your geo data into GeoJSON,https://www.bootcdn.cn/jquery-validation-unobtrusive/,,,,,,,,,,,,,,,,,,,,,,,,,,,,
2695,geojson,Django.js provides tools for JavaScript development with Django.,https://www.bootcdn.cn/geojson/,,,,,,,,,,,,,,,,,,,,,,,,,,,,
2696,django.js,React Disqus thread component,https://www.bootcdn.cn/django.js/,,,,,,,,,,,,,,,,,,,,,,,,,,,,
2697,react-disqus-thread,This plugin can get contents of iframe and set height of iframe automatically. Also it has cross-domain fix,https://www.bootcdn.cn/react-disqus-thread/,,,,,,,,,,,,,,,,,,,,,,,,,,,,
2698,Iframe-Height-Jquery-Plugin,Cinnamon.js takes some of the pain out of naming things. It’s a script that allows users to find links,,,,,,,,,,,,,,,,,,,,,,,,,,,,,
2699,cinnamon.js,Javascript SDK for communicating w/ a Sails server via WebSockets/socket.io.,https://www.bootcdn.cn/cinnamon.js/,,,,,,,,,,,,,,,,,,,,,,,,,,,,
2700,sails.io.js,Age is a jQuery plugin that formats and tracks dates and times as human readable text.,https://www.bootcdn.cn/sails.io.js/,,,,,,,,,,,,,,,,,,,,,,,,,,,,
2701,jquery.age,A simple jQuery plugin for sexy scrolling effects using CSS3 transitions and transforms.,https://www.bootcdn.cn/jquery.age/,,,,,,,,,,,,,,,,,,,,,,,,,,,,
2702,jquery-smoove,Jodit is awesome and usefully wysiwyg editor with filebrowser,https://www.bootcdn.cn/jquery-smoove/,,,,,,,,,,,,,,,,,,,,,,,,,,,,
2703,jodit,Color Picker Directive For AngularJS,https://www.bootcdn.cn/jodit/,,,,,,,,,,,,,,,,,,,,,,,,,,,,
2704,angularjs-color-picker,An Angular.js YouTube video background player directive that stresses simplicity and performance.,https://www.bootcdn.cn/angularjs-color-picker/,,,,,,,,,,,,,,,,,,,,,,,,,,,,
2705,angular-video-bg,organization chart plugin based on ES6,https://www.bootcdn.cn/angular-video-bg/,,,,,,,,,,,,,,,,,,,,,,,,,,,,
2706,OrgChart.js,AngularJS PDF viewer directive using pdf.js.,https://www.bootcdn.cn/OrgChart.js/,,,,,,,,,,,,,,,,,,,,,,,,,,,,
2707,ng-pdfviewer,SPServices is a jQuery library which abstracts SharePoint's Web Services and makes them easier to use. It also includes functions which use the various Web Service operations to provide more useful (and cool) capabilities. It works entirely client side and requires no server install.,https://www.bootcdn.cn/ng-pdfviewer/,,,,,,,,,,,,,,,,,,,,,,,,,,,,
2708,jquery.SPServices,ECMAScript 7 compatibility shims for legacy JavaScript engines,https://www.bootcdn.cn/jquery.SPServices/,,,,,,,,,,,,,,,,,,,,,,,,,,,,
2709,es7-shim,Makes it possible to have a fixed position element that is relative to it's parent. In other words,,,,,,,,,,,,,,,,,,,,,,,,,,,,,
2710,stickyfloat,jQuery Clock,,,,,,,,,,,,,,,,,,,,,,,,,,,,,
2711,flipcountdown,Array manipulation,, etc.";"https://www.bootcdn.cn/flipcountdown/",,,,,,,,,,,,,,,,,,,,,,,,,,,
2712,d3-array,A plugin for svg.js adding filter functionality,https://www.bootcdn.cn/d3-array/,,,,,,,,,,,,,,,,,,,,,,,,,,,,
2713,svg.filter.js,CSS-only tooltip packed with a variety of features.,https://www.bootcdn.cn/svg.filter.js/,,,,,,,,,,,,,,,,,,,,,,,,,,,,
2714,simple-hint,An ember-data adapter for django web applications powered by the django-rest-framework,https://www.bootcdn.cn/simple-hint/,,,,,,,,,,,,,,,,,,,,,,,,,,,,
2715,ember-data-django-rest-adapter,Confirmation plugin compatible with Twitter Bootstrap 3 extending Popover,https://www.bootcdn.cn/ember-data-django-rest-adapter/,,,,,,,,,,,,,,,,,,,,,,,,,,,,
2716,bootstrap-confirmation,Library for composing asynchronous and event-based operations in JavaScript,https://www.bootcdn.cn/bootstrap-confirmation/,,,,,,,,,,,,,,,,,,,,,,,,,,,,
2717,ixjs,A simple bootstrap 3 contact form using Google's reCAPTCHA. Submitted messages are sent to a specified email address using SMTP with support for SSL or TLS transport.,https://www.bootcdn.cn/ixjs/,,,,,,,,,,,,,,,,,,,,,,,,,,,,
2718,bootstrap3-contact-form,angularJS service to load dynamically CSS files,https://www.bootcdn.cn/bootstrap3-contact-form/,,,,,,,,,,,,,,,,,,,,,,,,,,,,
2719,angular-css-injector,pnp - provides a fluent api for working with SharePoint REST,https://www.bootcdn.cn/angular-css-injector/,,,,,,,,,,,,,,,,,,,,,,,,,,,,
2720,pnp-sp,pnp - provides functionality for working within SharePoint add-ins,https://www.bootcdn.cn/pnp-sp/,,,,,,,,,,,,,,,,,,,,,,,,,,,,
2721,pnp-sp-taxonomy,pnp - provides functionality for working within SharePoint add-ins,https://www.bootcdn.cn/pnp-sp-taxonomy/,,,,,,,,,,,,,,,,,,,,,,,,,,,,
2722,pnp-sp-clientsvc,pnp - provides functionality for working within SharePoint add-ins,https://www.bootcdn.cn/pnp-sp-clientsvc/,,,,,,,,,,,,,,,,,,,,,,,,,,,,
2723,pnp-sp-addinhelpers,pnp - rollup library of core functionality (mimics sp-pnp-js),https://www.bootcdn.cn/pnp-sp-addinhelpers/,,,,,,,,,,,,,,,,,,,,,,,,,,,,
2724,pnp-pnpjs,pnp - provides shared odata functionality and base classes,https://www.bootcdn.cn/pnp-pnpjs/,,,,,,,,,,,,,,,,,,,,,,,,,,,,
2725,pnp-odata,pnp - light-weight,,,,,,,,,,,,,,,,,,,,,,,,,,,,,
2726,pnp-logging,pnp - provides functionality to query the Microsoft Graph,https://www.bootcdn.cn/pnp-logging/,,,,,,,,,,,,,,,,,,,,,,,,,,,,
2727,pnp-graph,pnp - provides a way to manage configuration within your application,https://www.bootcdn.cn/pnp-graph/,,,,,,,,,,,,,,,,,,,,,,,,,,,,
2728,pnp-config-store,pnp - provides shared functionality across all pnp libraries,https://www.bootcdn.cn/pnp-config-store/,,,,,,,,,,,,,,,,,,,,,,,,,,,,
2729,pnp-common,Knockout.js meets ECMAScript 5 properties,https://www.bootcdn.cn/pnp-common/,,,,,,,,,,,,,,,,,,,,,,,,,,,,
2730,knockout-es5,Turn a jQuery UI Menu widget into a contextmenu.,https://www.bootcdn.cn/knockout-es5/,,,,,,,,,,,,,,,,,,,,,,,,,,,,
2731,jquery.ui-contextmenu,Switch the background image with using effect.,https://www.bootcdn.cn/jquery.ui-contextmenu/,,,,,,,,,,,,,,,,,,,,,,,,,,,,
2732,jQuery.BgSwitcher,Angular Confirm Modal,https://www.bootcdn.cn/jQuery.BgSwitcher/,,,,,,,,,,,,,,,,,,,,,,,,,,,,
2733,angular-confirm,A full-featured JavaScript Textile parser,https://www.bootcdn.cn/angular-confirm/,,,,,,,,,,,,,,,,,,,,,,,,,,,,
2734,textile-js,AngularJS provider,,,,,,,,,,,,,,,,,,,,,,,,,,,,,
2735,ng-i18next,The goal of this library is to provide an easy-to-use way for training and testing MNIST digits for neural networks (either in the browser or node.js).,https://www.bootcdn.cn/ng-i18next/,,,,,,,,,,,,,,,,,,,,,,,,,,,,
2736,mnist,Adds touch gesture events to jQuery,https://www.bootcdn.cn/mnist/,,,,,,,,,,,,,,,,,,,,,,,,,,,,
2737,jquery.touch,Emoji plugin for markdown-it markdown parser.,https://www.bootcdn.cn/jquery.touch/,,,,,,,,,,,,,,,,,,,,,,,,,,,,
2738,markdown-it-emoji,A simple queue for ajax requests,https://www.bootcdn.cn/markdown-it-emoji/,,,,,,,,,,,,,,,,,,,,,,,,,,,,
2739,jquery-ajaxQueue,Font-linux is an icon font containing logos of popular linux distributions for inclusion in websites.,https://www.bootcdn.cn/jquery-ajaxQueue/,,,,,,,,,,,,,,,,,,,,,,,,,,,,
2740,font-linux,Emscripten-compiled scrypt,,,,,,,,,,,,,,,,,,,,,,,,,,,,,
2741,js-scrypt,Automatically adjust textarea height based on user input. Non-sucking version.,https://www.bootcdn.cn/js-scrypt/,,,,,,,,,,,,,,,,,,,,,,,,,,,,
2742,jquery.ns-autogrow,Webkit Notification plugin. That makes your life easear.,https://www.bootcdn.cn/jquery.ns-autogrow/,,,,,,,,,,,,,,,,,,,,,,,,,,,,
2743,jquery.notification,A jQuery plugin that helps ease the pain when having to deal with IE z-index issues.,https://www.bootcdn.cn/jquery.notification/,,,,,,,,,,,,,,,,,,,,,,,,,,,,
2744,jquery-bgiframe,Slim vanilla javascript select dropdown,https://www.bootcdn.cn/jquery-bgiframe/,,,,,,,,,,,,,,,,,,,,,,,,,,,,
2745,slim-select,A lightweight jQuery magnifying glass zoom plugin.,https://www.bootcdn.cn/slim-select/,,,,,,,,,,,,,,,,,,,,,,,,,,,,
2746,magnify,jQuery plugin for using FontAwesome icons as custom CSS cursors,https://www.bootcdn.cn/magnify/,,,,,,,,,,,,,,,,,,,,,,,,,,,,
2747,jquery-awesome-cursor,Angular.JS directive for gravatar images,https://www.bootcdn.cn/jquery-awesome-cursor/,,,,,,,,,,,,,,,,,,,,,,,,,,,,
2748,angular-gravatar,A simple,,,,,,,,,,,,,,,,,,,,,,,,,,,,,
2749,nivo-lightbox,A multi level dependent dropdown JQuery plugin that allows nested dependencies.,https://www.bootcdn.cn/nivo-lightbox/,,,,,,,,,,,,,,,,,,,,,,,,,,,,
2750,dependent-dropdown,addon to d3.js that wraps SVG transforms into an API,https://www.bootcdn.cn/dependent-dropdown/,,,,,,,,,,,,,,,,,,,,,,,,,,,,
2751,d3-transform,Date-time picker AngularJS Bootstrap plugin,https://www.bootcdn.cn/d3-transform/,,,,,,,,,,,,,,,,,,,,,,,,,,,,
2752,angular-js-bootstrap-datetimepicker,A Leaflet layer control with support for grouping overlays together,https://www.bootcdn.cn/angular-js-bootstrap-datetimepicker/,,,,,,,,,,,,,,,,,,,,,,,,,,,,
2753,leaflet-groupedlayercontrol,Hand.js is a polyfill for pointer events.,https://www.bootcdn.cn/leaflet-groupedlayercontrol/,,,,,,,,,,,,,,,,,,,,,,,,,,,,
2754,handjs,Allows making fluent OData queries from angular resources,https://www.bootcdn.cn/handjs/,,,,,,,,,,,,,,,,,,,,,,,,,,,,
2755,ODataResources,Directive that works in conjunction with currency filter.,https://www.bootcdn.cn/ODataResources/,,,,,,,,,,,,,,,,,,,,,,,,,,,,
2756,ng-currency,jscolor is a web color picker component that aims to be super easy both for developers to install and end users to use.,https://www.bootcdn.cn/ng-currency/,,,,,,,,,,,,,,,,,,,,,,,,,,,,
2757,jscolor,The standard DOM Driver for Cycle.js,,,,,,,,,,,,,,,,,,,,,,,,,,,,,
2758,cyclejs-dom,Animate CSS jQuery Plugin,https://www.bootcdn.cn/cyclejs-dom/,,,,,,,,,,,,,,,,,,,,,,,,,,,,
2759,animateCSS,A simple SHA1 hash function for JavaScript supports UTF-8 encoding.,https://www.bootcdn.cn/animateCSS/,,,,,,,,,,,,,,,,,,,,,,,,,,,,
2760,js-sha1,Jouele is a simple and beautiful audio player for the web.,https://www.bootcdn.cn/js-sha1/,,,,,,,,,,,,,,,,,,,,,,,,,,,,
2761,Jouele,Drag and drop SVG,,,,,,,,,,,,,,,,,,,,,,,,,,,,,
2762,d3-drag,AngularJS provider and service for Pusher,https://www.bootcdn.cn/d3-drag/,,,,,,,,,,,,,,,,,,,,,,,,,,,,
2763,angular-pusher,A standalone javascript library for cross-browser mouse wheel support.,https://www.bootcdn.cn/angular-pusher/,,,,,,,,,,,,,,,,,,,,,,,,,,,,
2764,hamsterjs,A powerful asynchronous validation library,https://www.bootcdn.cn/hamsterjs/,,,,,,,,,,,,,,,,,,,,,,,,,,,,
2765,verify,AngularJS directive slider control.,https://www.bootcdn.cn/verify/,,,,,,,,,,,,,,,,,,,,,,,,,,,,
2766,ng-slider,A RESTful Javascript ORM for AngularJS,https://www.bootcdn.cn/ng-slider/,,,,,,,,,,,,,,,,,,,,,,,,,,,,
2767,ModelCore,Slide Reveal,https://www.bootcdn.cn/ModelCore/,,,,,,,,,,,,,,,,,,,,,,,,,,,,
2768,slideReveal,A lightweight plugin / dependency system for javascript libraries.,https://www.bootcdn.cn/slideReveal/,,,,,,,,,,,,,,,,,,,,,,,,,,,,
2769,microplugin,jQuery plugin for simulating browser mouse and keyboard events,https://www.bootcdn.cn/microplugin/,,,,,,,,,,,,,,,,,,,,,,,,,,,,
2770,jquery-simulate,bacon.js bindings for AngularJS,https://www.bootcdn.cn/jquery-simulate/,,,,,,,,,,,,,,,,,,,,,,,,,,,,
2771,angular-bacon,Infect.js is a simple way to add the magic of dependency injection to any web project,,,,,,,,,,,,,,,,,,,,,,,,,,,,,
2772,infect,A simple library to connect your Ember.js application to JSON backends.,https://www.bootcdn.cn/infect/,,,,,,,,,,,,,,,,,,,,,,,,,,,,
2773,ember-resource.js,A table with dynamic components for vue.js,https://www.bootcdn.cn/ember-resource.js/,,,,,,,,,,,,,,,,,,,,,,,,,,,,
2774,vue-smart-table,A faster JavaScript memoizer,https://www.bootcdn.cn/vue-smart-table/,,,,,,,,,,,,,,,,,,,,,,,,,,,,
2775,memoizejs,A calculator for humanity’s peculiar conventions of time.,https://www.bootcdn.cn/memoizejs/,,,,,,,,,,,,,,,,,,,,,,,,,,,,
2776,d3-time,A JavaScript time formatter and parser inspired by strftime and strptime.,https://www.bootcdn.cn/d3-time/,,,,,,,,,,,,,,,,,,,,,,,,,,,,
2777,d3-time-format,video.js plugin that adds a navigable waveform for audio and video files.,https://www.bootcdn.cn/d3-time-format/,,,,,,,,,,,,,,,,,,,,,,,,,,,,
2778,videojs-wavesurfer,Simple demos of your applications' terminal commands.,https://www.bootcdn.cn/videojs-wavesurfer/,,,,,,,,,,,,,,,,,,,,,,,,,,,,
2779,show-your-terms,A 6KB JavaScript plugin for the Instagram API (without jQuery).,https://www.bootcdn.cn/show-your-terms/,,,,,,,,,,,,,,,,,,,,,,,,,,,,
2780,instafetch.js,Customizable replacement for html select (not only) with events,,,,,,,,,,,,,,,,,,,,,,,,,,,,,
2781,heapbox,Angular service to test if a given @media statment is true.,https://www.bootcdn.cn/heapbox/,,,,,,,,,,,,,,,,,,,,,,,,,,,,
2782,angular-media-queries,A performance optimized infinite bit vector library,https://www.bootcdn.cn/angular-media-queries/,,,,,,,,,,,,,,,,,,,,,,,,,,,,
2783,bitset.js,An angular filter to convert objects to arrays for easy filtering and sorting,https://www.bootcdn.cn/bitset.js/,,,,,,,,,,,,,,,,,,,,,,,,,,,,
2784,angular-toarrayfilter,progress bar thumbnails plugin for video.js,https://www.bootcdn.cn/angular-toarrayfilter/,,,,,,,,,,,,,,,,,,,,,,,,,,,,
2785,videojs-thumbnails,matchmedia wrapper for AngularJS,https://www.bootcdn.cn/videojs-thumbnails/,,,,,,,,,,,,,,,,,,,,,,,,,,,,
2786,matchmedia-ng,A simple and flexible plugin to do declarative event delegation in Knockout.js,https://www.bootcdn.cn/matchmedia-ng/,,,,,,,,,,,,,,,,,,,,,,,,,,,,
2787,knockout-delegated-events,JavaScript MVC Microframework,https://www.bootcdn.cn/knockout-delegated-events/,,,,,,,,,,,,,,,,,,,,,,,,,,,,
2788,gillie,The library creates and manages per-zoom-level clusters for large amounts of markers.,https://www.bootcdn.cn/gillie/,,,,,,,,,,,,,,,,,,,,,,,,,,,,
2789,markerclustererplus,Kule CSS Lazy,,,,,,,,,,,,,,,,,,,,,,,,,,,,,
2790,kule.lazy,Library for converting HTML into valid Markdown,https://www.bootcdn.cn/kule.lazy/,,,,,,,,,,,,,,,,,,,,,,,,,,,,
2791,europa,Concrete is a lightweight Html5 Canvas framework that enables hit detection,, and downloads.";"https://www.bootcdn.cn/europa/",,,,,,,,,,,,,,,,,,,,,,,,,,,
2792,concretejs,The Easiest Way to Create a Sliding Nav Menu with jQuery,https://www.bootcdn.cn/concretejs/,,,,,,,,,,,,,,,,,,,,,,,,,,,,
2793,sliiide,A jQuery plugin to turn form data into JSON,https://www.bootcdn.cn/sliiide/,,,,,,,,,,,,,,,,,,,,,,,,,,,,
2794,jQuery.serializeObject,Shadow DOM polyfill,https://www.bootcdn.cn/jQuery.serializeObject/,,,,,,,,,,,,,,,,,,,,,,,,,,,,
2795,shadydom,Allows highlighting words and sentences in textareas,https://www.bootcdn.cn/shadydom/,,,,,,,,,,,,,,,,,,,,,,,,,,,,
2796,jquery-highlighttextarea,Lightweight HTML5 Canvas library,https://www.bootcdn.cn/jquery-highlighttextarea/,,,,,,,,,,,,,,,,,,,,,,,,,,,,
2797,imagine.js,A plugin to display simple overlays during video playback.,https://www.bootcdn.cn/imagine.js/,,,,,,,,,,,,,,,,,,,,,,,,,,,,
2798,videojs-overlay,Genericons are vector icons embedded in a webfont designed to be clean and simple keeping with a generic aesthetic. Use for instant HiDPI or to easily change colors on the fly.,https://www.bootcdn.cn/videojs-overlay/,,,,,,,,,,,,,,,,,,,,,,,,,,,,
2799,genericons,An open framework for the financial services industry.,https://www.bootcdn.cn/genericons/,,,,,,,,,,,,,,,,,,,,,,,,,,,,
