id,title,content,link,,,,,,,,,,,,,,,,,,,,,,,,,,,,
1709,d3.chart,Vue2 leaflet library,https://www.bootcdn.cn/d3.chart/,,,,,,,,,,,,,,,,,,,,,,,,,,,,
1710,Vue2Leaflet,Voyeur is a tiny (1.2kb) Javascript library that lets you traverse and manipulate the DOM the way it should have been.,https://www.bootcdn.cn/Vue2Leaflet/,,,,,,,,,,,,,,,,,,,,,,,,,,,,
1711,Voyeur,Readable and beautiful underlines for every website.,https://www.bootcdn.cn/Voyeur/,,,,,,,,,,,,,,,,,,,,,,,,,,,,
1712,smart-underline,An adapter between Redux Form and Material UI components,https://www.bootcdn.cn/smart-underline/,,,,,,,,,,,,,,,,,,,,,,,,,,,,
1713,redux-form-material-ui,Class provider with classical inheritance interface,https://www.bootcdn.cn/redux-form-material-ui/,,,,,,,,,,,,,,,,,,,,,,,,,,,,
1714,klass,un-suck JavaScript APIs in IE8 & 9,https://www.bootcdn.cn/klass/,,,,,,,,,,,,,,,,,,,,,,,,,,,,
1715,aight,A Javascript toolkit to speed up the development of graph visualization and interaction applications.,https://www.bootcdn.cn/aight/,,,,,,,,,,,,,,,,,,,,,,,,,,,,
1716,linkurious.js,YouTube playback technology for Video.js,https://www.bootcdn.cn/linkurious.js/,,,,,,,,,,,,,,,,,,,,,,,,,,,,
1717,videojs-youtube,Context Menu implemented in React,https://www.bootcdn.cn/videojs-youtube/,,,,,,,,,,,,,,,,,,,,,,,,,,,,
1718,react-contextmenu,Sharing background across multiple elements using CSS,https://www.bootcdn.cn/react-contextmenu/,,,,,,,,,,,,,,,,,,,,,,,,,,,,
1719,multiple.js,Small JavaScript library for sprite based animations and panning,https://www.bootcdn.cn/multiple.js/,,,,,,,,,,,,,,,,,,,,,,,,,,,,
1720,motio,a strongly specified,,,,,,,,,,,,,,,,,,,,,,,,,,,,,
1721,commonmark,Override your input files with style.,https://www.bootcdn.cn/commonmark/,,,,,,,,,,,,,,,,,,,,,,,,,,,,
1722,Dropify,Generate PDF tables with jsPDF,https://www.bootcdn.cn/Dropify/,,,,,,,,,,,,,,,,,,,,,,,,,,,,
1723,jspdf-autotable,Stately.js is a JavaScript based finite-state machine (FSM) engine for Node.js and the browser.,https://www.bootcdn.cn/jspdf-autotable/,,,,,,,,,,,,,,,,,,,,,,,,,,,,
1724,stately.js,Standalone build of Babili (babel-minify) for use in non-Node.js environments,https://www.bootcdn.cn/stately.js/,,,,,,,,,,,,,,,,,,,,,,,,,,,,
1725,babili-standalone,Standalone build of Babel for use in non-Node.js environments. Similar to the (now deprecacted) babel-browser,https://www.bootcdn.cn/babili-standalone/,,,,,,,,,,,,,,,,,,,,,,,,,,,,
1726,babel-standalone,trunk8 is an intelligent text truncation plugin to jQuery. When applied to a large block of text,,,,,,,,,,,,,,,,,,,,,,,,,,,,,
1727,trunk8,linq.js - LINQ for JavaScript. Implements all .NET 4.0 LINQ to Objects methods and many extra methods (inspiration from Rx,, etc...)";"https://www.bootcdn.cn/trunk8/",,,,,,,,,,,,,,,,,,,,,,,,,,,
1728,linq.js,Salesforce API Library for JavaScript,https://www.bootcdn.cn/linq.js/,,,,,,,,,,,,,,,,,,,,,,,,,,,,
1729,jsforce,Calendar module for Semantic UI,https://www.bootcdn.cn/jsforce/,,,,,,,,,,,,,,,,,,,,,,,,,,,,
1730,semantic-ui-calendar,generate QR codes dynamically,https://www.bootcdn.cn/semantic-ui-calendar/,,,,,,,,,,,,,,,,,,,,,,,,,,,,
1731,lrsjng.jquery-qrcode,Device information and digital fingerprinting written in pure JavaScript.,https://www.bootcdn.cn/lrsjng.jquery-qrcode/,,,,,,,,,,,,,,,,,,,,,,,,,,,,
1732,ClientJS,Text animation library,https://www.bootcdn.cn/ClientJS/,,,,,,,,,,,,,,,,,,,,,,,,,,,,
1733,txt.wav,A theme for Select2 v4 and Bootstrap 3.,https://www.bootcdn.cn/txt.wav/,,,,,,,,,,,,,,,,,,,,,,,,,,,,
1734,select2-bootstrap-theme,Full Screen Vertical Scroll,https://www.bootcdn.cn/select2-bootstrap-theme/,,,,,,,,,,,,,,,,,,,,,,,,,,,,
1735,fsvs,Event-driven JavaScript framework,https://www.bootcdn.cn/fsvs/,,,,,,,,,,,,,,,,,,,,,,,,,,,,
1736,matreshka,A Cross-Browser,,,,,,,,,,,,,,,,,,,,,,,,,,,,,
1737,javascript-detect-element-resize,Bootstrap FileStyle is a quick and simple plugin to help style your form's file upload inputs.,https://www.bootcdn.cn/javascript-detect-element-resize/,,,,,,,,,,,,,,,,,,,,,,,,,,,,
1738,bootstrap-filestyle,Convert Word documents from docx to simple HTML and Markdown,https://www.bootcdn.cn/bootstrap-filestyle/,,,,,,,,,,,,,,,,,,,,,,,,,,,,
1739,mammoth,A polyfill to parse CSS links and rewrite pixel equivalents into head for non supporting browsers,https://www.bootcdn.cn/mammoth/,,,,,,,,,,,,,,,,,,,,,,,,,,,,
1740,rem,Client-side Validation for AngularJS,https://www.bootcdn.cn/rem/,,,,,,,,,,,,,,,,,,,,,,,,,,,,
1741,angular-validation,Angular directive to show an animated spinner (using spin.js),https://www.bootcdn.cn/angular-validation/,,,,,,,,,,,,,,,,,,,,,,,,,,,,
1742,angular-spinner,A simple jQuery pagination plugin,,,,,,,,,,,,,,,,,,,,,,,,,,,,,
1743,simplePagination.js,Ajax library with XHR2,,,,,,,,,,,,,,,,,,,,,,,,,,,,,
1744,qwest,HTML5 Canvas for Humans,https://www.bootcdn.cn/qwest/,,,,,,,,,,,,,,,,,,,,,,,,,,,,
1745,origamijs,Digital timing diagram in your browser,https://www.bootcdn.cn/origamijs/,,,,,,,,,,,,,,,,,,,,,,,,,,,,
1746,wavedrom,simple css to make select2 widgets fit in with bootstrap,https://www.bootcdn.cn/wavedrom/,,,,,,,,,,,,,,,,,,,,,,,,,,,,
1747,select2-bootstrap-css,Simple polyfill for URLSearchParams standard,https://www.bootcdn.cn/select2-bootstrap-css/,,,,,,,,,,,,,,,,,,,,,,,,,,,,
1748,url-search-params,CSS tooltips built on Tether,https://www.bootcdn.cn/url-search-params/,,,,,,,,,,,,,,,,,,,,,,,,,,,,
1749,tether-tooltip,A lightweight,,,,,,,,,,,,,,,,,,,,,,,,,,,,,
1750,typeit,Public Key Infrastructure (PKI) is the basis of how identity and key management is performed on the web today. PKIjs is a pure JavaScript library implementing the formats that are used in PKI applications. It is built on WebCrypto and aspires to make it possible to build native web applications that utilize X.509 and the related formats on the web without plug-ins,https://www.bootcdn.cn/typeit/,,,,,,,,,,,,,,,,,,,,,,,,,,,,
1751,PKI.js,A lightweight CSS3 image gallery plugin for jQuery that is pretty to look and and easy to use.,https://www.bootcdn.cn/PKI.js/,,,,,,,,,,,,,,,,,,,,,,,,,,,,
1752,photobox,Tiny set of CSS3 animations for your radio inputs.,https://www.bootcdn.cn/photobox/,,,,,,,,,,,,,,,,,,,,,,,,,,,,
1753,radiobox.css,Adds random noise to the background of a given element.,https://www.bootcdn.cn/radiobox.css/,,,,,,,,,,,,,,,,,,,,,,,,,,,,
1754,noisy,Angular Tree Control,https://www.bootcdn.cn/noisy/,,,,,,,,,,,,,,,,,,,,,,,,,,,,
1755,angular-tree-control,A moment.js plugin for formatting durations.,https://www.bootcdn.cn/angular-tree-control/,,,,,,,,,,,,,,,,,,,,,,,,,,,,
1756,moment-duration-format,Cross-browser CSS customizable scrollbar,https://www.bootcdn.cn/moment-duration-format/,,,,,,,,,,,,,,,,,,,,,,,,,,,,
1757,jquery.scrollbar,Quickly connect to,,,,,,,,,,,,,,,,,,,,,,,,,,,,,
1758,jquery-sheetrock,XML <=> JSON mapping/converting library,https://www.bootcdn.cn/jquery-sheetrock/,,,,,,,,,,,,,,,,,,,,,,,,,,,,
1759,x2js,A fast,,,,,,,,,,,,,,,,,,,,,,,,,,,,,
1760,valine,Bootstrap 3 components implemented by Vue 2.,https://www.bootcdn.cn/valine/,,,,,,,,,,,,,,,,,,,,,,,,,,,,
1761,uiv,Extended geographic projections for D3.js.,https://www.bootcdn.cn/uiv/,,,,,,,,,,,,,,,,,,,,,,,,,,,,
1762,d3-geo-projection,Easily reveal or hide password field contents via JavaScript or a nifty inner toggle button. Supports touch quite nicely!,https://www.bootcdn.cn/d3-geo-projection/,,,,,,,,,,,,,,,,,,,,,,,,,,,,
1763,hideshowpassword,⚡ Lightning-fast search for React and React Native apps,,,,,,,,,,,,,,,,,,,,,,,,,,,,,
1764,react-instantsearch,Fetch JSONP like a boss using Fetch API,https://www.bootcdn.cn/react-instantsearch/,,,,,,,,,,,,,,,,,,,,,,,,,,,,
1765,fetch-jsonp,An visual feedback indicator for the MaxLength attribute,https://www.bootcdn.cn/fetch-jsonp/,,,,,,,,,,,,,,,,,,,,,,,,,,,,
1766,bootstrap-maxlength,An arbitrary length integer library for Javascript,https://www.bootcdn.cn/bootstrap-maxlength/,,,,,,,,,,,,,,,,,,,,,,,,,,,,
1767,big-integer,Angular Chosen directive is an AngularJS Directive that brings the Chosen jQuery in a Angular way,https://www.bootcdn.cn/big-integer/,,,,,,,,,,,,,,,,,,,,,,,,,,,,
1768,angular-chosen-localytics,A lightweight front-end boilerplate,https://www.bootcdn.cn/angular-chosen-localytics/,,,,,,,,,,,,,,,,,,,,,,,,,,,,
1769,Kraken,jQuery plugin for displaying a tree structure in a (HTML) table,,,,,,,,,,,,,,,,,,,,,,,,,,,,,
1770,jquery-treetable,Resize an iframe responsively depending on the height of its content and the width of its container.,https://www.bootcdn.cn/jquery-treetable/,,,,,,,,,,,,,,,,,,,,,,,,,,,,
1771,pym,A collection of branding colors of all the major companies.,https://www.bootcdn.cn/pym/,,,,,,,,,,,,,,,,,,,,,,,,,,,,
1772,brand-colors,angular2-formly is an Angular 2 module which has a Components to help customize and render JavaScript/JSON configured forms. The formly-form Component and the FormlyConfig service are very powerful and bring unmatched maintainability to your application's,https://www.bootcdn.cn/brand-colors/,,,,,,,,,,,,,,,,,,,,,,,,,,,,
1773,ng2-formly,Template antimatter for JavaScript,https://www.bootcdn.cn/ng2-formly/,,,,,,,,,,,,,,,,,,,,,,,,,,,,
1774,weld,Load data while still loading other scripts,,,,,,,,,,,,,,,,,,,,,,,,,,,,,
1775,pegasus,Lockr is an extremely lightweight library (<2kb when minified),,,,,,,,,,,,,,,,,,,,,,,,,,,,,
1776,lockr,jQuery plugin to scroll the text like the old traditional marquee http://aamirafridi.com/jquery/jquery-marquee-plugin — Edit,https://www.bootcdn.cn/lockr/,,,,,,,,,,,,,,,,,,,,,,,,,,,,
1777,jQuery.Marquee,HTML layout helper based on CSS flexbox specification.,https://www.bootcdn.cn/jQuery.Marquee/,,,,,,,,,,,,,,,,,,,,,,,,,,,,
1778,flex-layout-attribute,CSS unit and integration testing,https://www.bootcdn.cn/flex-layout-attribute/,,,,,,,,,,,,,,,,,,,,,,,,,,,,
1779,quixote,Elastic (autosize) textareas for AngularJS,,,,,,,,,,,,,,,,,,,,,,,,,,,,,
1780,angular-elastic,Standalone JavaScript YAML 1.2 Parser & Encoder. Works under node.js and all major browsers. Also brings command line YAML/JSON conversion tools.,https://www.bootcdn.cn/angular-elastic/,,,,,,,,,,,,,,,,,,,,,,,,,,,,
1781,yamljs,provides you a way to monitor user activity with a page.,https://www.bootcdn.cn/yamljs/,,,,,,,,,,,,,,,,,,,,,,,,,,,,
1782,jquery-idletimer,A simple,,,,,,,,,,,,,,,,,,,,,,,,,,,,,
1783,ng-notify,JavaScript library for inform users of password strength,https://www.bootcdn.cn/ng-notify/,,,,,,,,,,,,,,,,,,,,,,,,,,,,
1784,jquery.complexify.js,A javascript slider selector that supports dates,https://www.bootcdn.cn/jquery.complexify.js/,,,,,,,,,,,,,,,,,,,,,,,,,,,,
1785,jQRangeSlider,ImgAreaSelect is a plugin for selecting a rectangular area of an image. It allows web developers to easily implement image cropping functionality,,,,,,,,,,,,,,,,,,,,,,,,,,,,,
1786,imgareaselect,Port of TweetNaCl cryptographic library to JavaScript,https://www.bootcdn.cn/imgareaselect/,,,,,,,,,,,,,,,,,,,,,,,,,,,,
1787,tweetnacl,Lightweight tooltip for the greater good,https://www.bootcdn.cn/tweetnacl/,,,,,,,,,,,,,,,,,,,,,,,,,,,,
1788,wenk,A cross-browser framework-independent responsive images loader,https://www.bootcdn.cn/wenk/,,,,,,,,,,,,,,,,,,,,,,,,,,,,
1789,riloadr,Capture form validation back from the browser,https://www.bootcdn.cn/riloadr/,,,,,,,,,,,,,,,,,,,,,,,,,,,,
1790,hyperform,A pure JavaScript implementation of the AES block cipher and all common modes of operation.,https://www.bootcdn.cn/hyperform/,,,,,,,,,,,,,,,,,,,,,,,,,,,,
1791,aes-js,Deliver synchronous ads asynchronously with RWD support without modifying the ad code.,https://www.bootcdn.cn/aes-js/,,,,,,,,,,,,,,,,,,,,,,,,,,,,
1792,lazyad-loader,jQuery animate number plugin,https://www.bootcdn.cn/lazyad-loader/,,,,,,,,,,,,,,,,,,,,,,,,,,,,
1793,jquery-animateNumber,Androidicons is a professional,,,,,,,,,,,,,,,,,,,,,,,,,,,,,
1794,androidicons,A stupidly small and simple jQuery table sorter plugin,https://www.bootcdn.cn/androidicons/,,,,,,,,,,,,,,,,,,,,,,,,,,,,
1795,stupidtable,Deals with overlapping markers in Google Maps JS API v3,,,,,,,,,,,,,,,,,,,,,,,,,,,,,
1796,OverlappingMarkerSpiderfier,JavaScript Graph Layouting and Drawing,https://www.bootcdn.cn/OverlappingMarkerSpiderfier/,,,,,,,,,,,,,,,,,,,,,,,,,,,,
1797,graphdracula,fast and fully-featured autocomplete library,https://www.bootcdn.cn/graphdracula/,,,,,,,,,,,,,,,,,,,,,,,,,,,,
1798,corejs-typeahead,Polyfill to remove click delays on browsers with touch UIs.,https://www.bootcdn.cn/corejs-typeahead/,,,,,,,,,,,,,,,,,,,,,,,,,,,,
1799,jquery-touch-events,Ajax module in Vanilla JS,https://www.bootcdn.cn/jquery-touch-events/,,,,,,,,,,,,,,,,,,,,,,,,,,,,
1800,fdaciuk-ajax,jQuery plugin to generate Google Maps,https://www.bootcdn.cn/fdaciuk-ajax/,,,,,,,,,,,,,,,,,,,,,,,,,,,,
1801,gmap3,Fast Pure JavaScript MessagePack Encoder and Decoder,https://www.bootcdn.cn/gmap3/,,,,,,,,,,,,,,,,,,,,,,,,,,,,
1802,msgpack-lite,A lightweight jQuery plugin that replaces native select elements with customizable dropdowns.,https://www.bootcdn.cn/msgpack-lite/,,,,,,,,,,,,,,,,,,,,,,,,,,,,
1803,jquery-nice-select,GitHub-style identicons in JS with no server-side processing.,https://www.bootcdn.cn/jquery-nice-select/,,,,,,,,,,,,,,,,,,,,,,,,,,,,
1804,identicon.js,`img` tag enhancement for 360° object movies,,,,,,,,,,,,,,,,,,,,,,,,,,,,,
1805,reel.js,Minimalistic Virtual DOM implementation with support for animated transitions.,https://www.bootcdn.cn/reel.js/,,,,,,,,,,,,,,,,,,,,,,,,,,,,
1806,maquette,A basic but performant promise implementation,https://www.bootcdn.cn/maquette/,,,,,,,,,,,,,,,,,,,,,,,,,,,,
1807,lie,A NoSQL document store database for browsers and Node.js.,https://www.bootcdn.cn/lie/,,,,,,,,,,,,,,,,,,,,,,,,,,,,
1808,forerunnerdb,Minimalistic Virtual DOM implementation with support for animated transitions.,https://www.bootcdn.cn/forerunnerdb/,,,,,,,,,,,,,,,,,,,,,,,,,,,,
1809,domplotter,A Storage done right for AngularJS,https://www.bootcdn.cn/domplotter/,,,,,,,,,,,,,,,,,,,,,,,,,,,,
1810,angular-storage,Minimal,,,,,,,,,,,,,,,,,,,,,,,,,,,,,
1811,jquery-bar-rating,A cross-browser wrapper for IndexedDB,https://www.bootcdn.cn/jquery-bar-rating/,,,,,,,,,,,,,,,,,,,,,,,,,,,,
1812,idbwrapper,Gettext support for Angular.js,https://www.bootcdn.cn/idbwrapper/,,,,,,,,,,,,,,,,,,,,,,,,,,,,
1813,angular-gettext,TinyNav.js is a tiny jQuery plugin (452 bytes minified and gzipped) that converts <ul> and <ol> navigations to a select boxes for small screen.,https://www.bootcdn.cn/angular-gettext/,,,,,,,,,,,,,,,,,,,,,,,,,,,,
1814,TinyNav.js,Datepicker for bootstrap-material,https://www.bootcdn.cn/TinyNav.js/,,,,,,,,,,,,,,,,,,,,,,,,,,,,
1815,bootstrap-material-datetimepicker,Easily convert unordered lists & other nested HTML structures into entertaining,,,,,,,,,,,,,,,,,,,,,,,,,,,,,
1816,roundabout,JavaScript plugin for playing sounds and music in web,https://www.bootcdn.cn/roundabout/,,,,,,,,,,,,,,,,,,,,,,,,,,,,
1817,ion-sound,Angular Google Analytics - Easy tracking for your AngularJS application,https://www.bootcdn.cn/ion-sound/,,,,,,,,,,,,,,,,,,,,,,,,,,,,
1818,angular-google-analytics,Allows to use React.js component as custom element,https://www.bootcdn.cn/angular-google-analytics/,,,,,,,,,,,,,,,,,,,,,,,,,,,,
1819,reactive-elements,Social sharing links and buttons without the bloat,https://www.bootcdn.cn/reactive-elements/,,,,,,,,,,,,,,,,,,,,,,,,,,,,
1820,social-sharing,Human-friendly HSL,https://www.bootcdn.cn/social-sharing/,,,,,,,,,,,,,,,,,,,,,,,,,,,,
1821,husl,A Typographic Starter Kit,https://www.bootcdn.cn/husl/,,,,,,,,,,,,,,,,,,,,,,,,,,,,
1822,typeplate-starter-kit,Manipulate and traverse tree-like structures in javascript.,https://www.bootcdn.cn/typeplate-starter-kit/,,,,,,,,,,,,,,,,,,,,,,,,,,,,
1823,tree-model,Make it snow on you page or elements,https://www.bootcdn.cn/tree-model/,,,,,,,,,,,,,,,,,,,,,,,,,,,,
1824,JQuery-Snowfall,A service to handle common dialog types in a web application. Built on top of Angular-Bootstrap's modal,https://www.bootcdn.cn/JQuery-Snowfall/,,,,,,,,,,,,,,,,,,,,,,,,,,,,
1825,angular-dialog-service,A JavaScript 2D vector class with methods for common vector operations,https://www.bootcdn.cn/angular-dialog-service/,,,,,,,,,,,,,,,,,,,,,,,,,,,,
1826,victor,Smart Banners are feature in iOS 6+ to promote App Store apps on your website. This jQuery plugin brings this feature to older iOS versions and Android devices.,https://www.bootcdn.cn/victor/,,,,,,,,,,,,,,,,,,,,,,,,,,,,
1827,jquery.smartbanner,Stop your iOS webapp from bouncing around when scrolling,https://www.bootcdn.cn/jquery.smartbanner/,,,,,,,,,,,,,,,,,,,,,,,,,,,,
1828,inobounce,SimpleStateManager ==================,https://www.bootcdn.cn/inobounce/,,,,,,,,,,,,,,,,,,,,,,,,,,,,
1829,simplestatemanager,Context-menu extension for the Bootstrap framework,https://www.bootcdn.cn/simplestatemanager/,,,,,,,,,,,,,,,,,,,,,,,,,,,,
1830,bootstrap-contextmenu,AngularJS module that uses SVG to create a circular progressar,https://www.bootcdn.cn/bootstrap-contextmenu/,,,,,,,,,,,,,,,,,,,,,,,,,,,,
1831,angular-svg-round-progressbar,Swipe is the most accurate touch slider,https://www.bootcdn.cn/angular-svg-round-progressbar/,,,,,,,,,,,,,,,,,,,,,,,,,,,,
1832,swipejs,jQuery plugin to arrange images into a flexible grid,https://www.bootcdn.cn/swipejs/,,,,,,,,,,,,,,,,,,,,,,,,,,,,
1833,photoset-grid,JavaScript library that prevents the autoplaying of the animated Gifs,https://www.bootcdn.cn/photoset-grid/,,,,,,,,,,,,,,,,,,,,,,,,,,,,
1834,gifffer,Native Promise Only: A polyfill for native ES6 Promises **only**,,,,,,,,,,,,,,,,,,,,,,,,,,,,,
1835,native-promise-only,SnackbarJS is a lightweight and jQuery powered plugin made to work in Bootstrap style,,,,,,,,,,,,,,,,,,,,,,,,,,,,,
1836,snackbarjs,Drag and drop module for Angular JS with support for touch devices.,https://www.bootcdn.cn/snackbarjs/,,,,,,,,,,,,,,,,,,,,,,,,,,,,
1837,ngDraggable,Elegant data binding for Backbone.js,https://www.bootcdn.cn/ngDraggable/,,,,,,,,,,,,,,,,,,,,,,,,,,,,
1838,backbone.epoxy,The officially supported Ember binding for Firebase,https://www.bootcdn.cn/backbone.epoxy/,,,,,,,,,,,,,,,,,,,,,,,,,,,,
1839,emberFire,Addon component wrappers for common UI transitions.,https://www.bootcdn.cn/emberFire/,,,,,,,,,,,,,,,,,,,,,,,,,,,,
1840,react-motion-ui-pack,jRespond is a simple way to globally manage javascript on responsive websites.,https://www.bootcdn.cn/react-motion-ui-pack/,,,,,,,,,,,,,,,,,,,,,,,,,,,,
1841,jRespond,Vertical scroll direction in CSS,https://www.bootcdn.cn/jRespond/,,,,,,,,,,,,,,,,,,,,,,,,,,,,
1842,scrolldir,fakeLoader.js is a lightweight jQuery plugin that helps you create an animated spinner with a fullscreen loading mask to simulate the page preloading effect.,https://www.bootcdn.cn/scrolldir/,,,,,,,,,,,,,,,,,,,,,,,,,,,,
1843,fakeLoader.js,AlgoliaSearch API JavaScript client,https://www.bootcdn.cn/fakeLoader.js/,,,,,,,,,,,,,,,,,,,,,,,,,,,,
1844,algoliasearch,A JavaScript library to load images progressively,https://www.bootcdn.cn/algoliasearch/,,,,,,,,,,,,,,,,,,,,,,,,,,,,
1845,progressively,A javascript library for filtering json object and rendering html,https://www.bootcdn.cn/progressively/,,,,,,,,,,,,,,,,,,,,,,,,,,,,
1846,filter.js,Operative: Inline Web-Worker Helper,https://www.bootcdn.cn/filter.js/,,,,,,,,,,,,,,,,,,,,,,,,,,,,
1847,operative,GPU accelerated BLAS for node and the browser,https://www.bootcdn.cn/operative/,,,,,,,,,,,,,,,,,,,,,,,,,,,,
1848,weblas,Vague.js is an experimental script that allows you to blur any kind of html element thanks to the SVG filters,https://www.bootcdn.cn/weblas/,,,,,,,,,,,,,,,,,,,,,,,,,,,,
1849,Vague.js,Animated anchor navigation made easy with jQuery,https://www.bootcdn.cn/Vague.js/,,,,,,,,,,,,,,,,,,,,,,,,,,,,
1850,jquery-localScroll,A forward-thinking,,,,,,,,,,,,,,,,,,,,,,,,,,,,,
1851,furtive,A legend component for d3. Given a d3.scale it can create either a color legend,,,,,,,,,,,,,,,,,,,,,,,,,,,,,
1852,d3-legend,AngularJS wrapper for SweetAlert,https://www.bootcdn.cn/d3-legend/,,,,,,,,,,,,,,,,,,,,,,,,,,,,
1853,angular-sweetalert,A jQuery plugin that will count up (or down) to a target number at a specified speed.,https://www.bootcdn.cn/angular-sweetalert/,,,,,,,,,,,,,,,,,,,,,,,,,,,,
1854,jquery-countto,Universal JavaScript Framework,https://www.bootcdn.cn/jquery-countto/,,,,,,,,,,,,,,,,,,,,,,,,,,,,
1855,qooxdoo,Miscellaneous plugins for Leaflet library for services that need to display route information and need satellite imagery from different providers,https://www.bootcdn.cn/qooxdoo/,,,,,,,,,,,,,,,,,,,,,,,,,,,,
1856,leaflet-plugins,jQuery plugin horizontal parallax scrolling.,https://www.bootcdn.cn/leaflet-plugins/,,,,,,,,,,,,,,,,,,,,,,,,,,,,
1857,jInvertScroll,Web Audio Library,https://www.bootcdn.cn/jInvertScroll/,,,,,,,,,,,,,,,,,,,,,,,,,,,,
1858,waud.js,It's a jQuery Plugin to format Date outputs using JavaScript.,https://www.bootcdn.cn/waud.js/,,,,,,,,,,,,,,,,,,,,,,,,,,,,
1859,jquery-dateFormat,jQCloud is a jQuery plugin that builds neat and pure HTML + CSS word clouds and tag clouds that are actually shaped like a cloud.,https://www.bootcdn.cn/jquery-dateFormat/,,,,,,,,,,,,,,,,,,,,,,,,,,,,
1860,jqcloud,Triangle background generator,https://www.bootcdn.cn/jqcloud/,,,,,,,,,,,,,,,,,,,,,,,,,,,,
1861,triangles,HTML5 Audio Compatibility Layer,https://www.bootcdn.cn/triangles/,,,,,,,,,,,,,,,,,,,,,,,,,,,,
1862,audio5js,Native ES6 @mentions,https://www.bootcdn.cn/audio5js/,,,,,,,,,,,,,,,,,,,,,,,,,,,,
1863,tributejs,Duotone filters made with CSS,https://www.bootcdn.cn/tributejs/,,,,,,,,,,,,,,,,,,,,,,,,,,,,
1864,colofilter.css,The brass buckles on Underscore's utility belt.,https://www.bootcdn.cn/colofilter.css/,,,,,,,,,,,,,,,,,,,,,,,,,,,,
1865,underscore-contrib,Custom Select Box CSS Style Plugin,https://www.bootcdn.cn/underscore-contrib/,,,,,,,,,,,,,,,,,,,,,,,,,,,,
1866,jquery.customSelect,gameQuery is a jQuery plug-in to help make javascript game development easier by adding some simple game-related classes,https://www.bootcdn.cn/jquery.customSelect/,,,,,,,,,,,,,,,,,,,,,,,,,,,,
1867,jquery-gamequery,A super simple currency formatting library,https://www.bootcdn.cn/jquery-gamequery/,,,,,,,,,,,,,,,,,,,,,,,,,,,,
1868,currencyformatter.js,Superclean,, BEM-syntax CSS grid system";"https://www.bootcdn.cn/currencyformatter.js/",,,,,,,,,,,,,,,,,,,,,,,,,,,
1869,avalanche-css,A video.js plugin for recording audio/video/image files.,https://www.bootcdn.cn/avalanche-css/,,,,,,,,,,,,,,,,,,,,,,,,,,,,
1870,videojs-record,A visualization toolkit for JavaScript using SVG.,https://www.bootcdn.cn/videojs-record/,,,,,,,,,,,,,,,,,,,,,,,,,,,,
1871,protovis,The Baremetrics date range picker is a simplified solution for selecting both date ranges and single dates all from a single calender view. There aren't a billion options but the code is pretty basic and modular so feel free to edit however to meet your own needs.,https://www.bootcdn.cn/protovis/,,,,,,,,,,,,,,,,,,,,,,,,,,,,
1872,baremetrics-calendar,A jQuery plugin for easy consumption of RESTful APIs,https://www.bootcdn.cn/baremetrics-calendar/,,,,,,,,,,,,,,,,,,,,,,,,,,,,
1873,jquery.rest,A polyfill that fetches external SVGs referenced in use elements when the browser itself fails to do so.,https://www.bootcdn.cn/jquery.rest/,,,,,,,,,,,,,,,,,,,,,,,,,,,,
1874,svgxuse,Printing plug-in for jQuery,https://www.bootcdn.cn/svgxuse/,,,,,,,,,,,,,,,,,,,,,,,,,,,,
1875,printThis,A color management API for JavaScript,https://www.bootcdn.cn/printThis/,,,,,,,,,,,,,,,,,,,,,,,,,,,,
1876,color-js,A Javscript utility for adding deep anchor links to online docs.,https://www.bootcdn.cn/color-js/,,,,,,,,,,,,,,,,,,,,,,,,,,,,
1877,anchor-js,Google Analytics on Steroids,https://www.bootcdn.cn/anchor-js/,,,,,,,,,,,,,,,,,,,,,,,,,,,,
1878,gas,A simple,,,,,,,,,,,,,,,,,,,,,,,,,,,,,
1879,cardkit,A simple library for data validation,https://www.bootcdn.cn/cardkit/,,,,,,,,,,,,,,,,,,,,,,,,,,,,
1880,valid.js,Instagram jQuery plugin,https://www.bootcdn.cn/valid.js/,,,,,,,,,,,,,,,,,,,,,,,,,,,,
1881,jquery-instagram,Display a unique seal in the developer console of your page.,https://www.bootcdn.cn/jquery-instagram/,,,,,,,,,,,,,,,,,,,,,,,,,,,,
1882,signet,Modal dialog effects with transitions CSS3,https://www.bootcdn.cn/signet/,,,,,,,,,,,,,,,,,,,,,,,,,,,,
1883,custombox,A lightweight jQuery plugin that counts up to a targeted number when the number becomes visible.,https://www.bootcdn.cn/custombox/,,,,,,,,,,,,,,,,,,,,,,,,,,,,
1884,Counter-Up,A feature-rich but lightweight ES6 AngularJS Data Table crafted for large data sets!,https://www.bootcdn.cn/Counter-Up/,,,,,,,,,,,,,,,,,,,,,,,,,,,,
1885,angular-data-table,HTML5 form validation,https://www.bootcdn.cn/angular-data-table/,,,,,,,,,,,,,,,,,,,,,,,,,,,,
1886,h5Validate,progressbar interactions for twitter bootstrap 2 & 3,https://www.bootcdn.cn/h5Validate/,,,,,,,,,,,,,,,,,,,,,,,,,,,,
1887,bootstrap-progressbar,The Leaflet Data Visualization Framework (DVF) is an extension to the Leaflet JavaScript mapping library. The primary goal of the framework is to simplify data visualization and thematic mapping using Leaflet - making it easier to turn raw data into compelling maps.,https://www.bootcdn.cn/bootstrap-progressbar/,,,,,,,,,,,,,,,,,,,,,,,,,,,,
1888,leaflet-dvf,Injects CSS into the document (it's a perfectly legal procedure),https://www.bootcdn.cn/leaflet-dvf/,,,,,,,,,,,,,,,,,,,,,,,,,,,,
1889,veinjs,Simple directive that turns arrays and objects into downloadable CSV files,https://www.bootcdn.cn/veinjs/,,,,,,,,,,,,,,,,,,,,,,,,,,,,
1890,ng-csv,A Javascript library for browser exploitation,https://www.bootcdn.cn/ng-csv/,,,,,,,,,,,,,,,,,,,,,,,,,,,,
1891,pwnjs,jQuery-JSONP is a compact,,,,,,,,,,,,,,,,,,,,,,,,,,,,,
1892,jQuery-JSONP,A functional test suite based on jQuery.,https://www.bootcdn.cn/jQuery-JSONP/,,,,,,,,,,,,,,,,,,,,,,,,,,,,
