id,title,content,link,,,,,,,,,,,,,,,,,,,,,,,,,,,,
1,twitter-bootstrap,Bootstrap 是全球最受欢迎的前端组件库，用于开发响应式布局、移动设备优先的 WEB 项目。,https://www.bootcdn.cn/twitter-bootstrap/, ,,,,,,,,,,,,,,,,,,,,,,,,,,,
2,vue,Vue 是一套用于构建用户界面的渐进式框架。与其它大型框架不同的是，Vue 被设计为可以自底向上逐层应用。Vue 的核心库只关注视图层，不仅易于上手，还便于与第三方库或既有项目整合。,https://www.bootcdn.cn/vue/, ,,,,,,,,,,,,,,,,,,,,,,,,,,,
3,react,React 是用于构建用户界面的 JavaScript 工具库。,https://www.bootcdn.cn/react/, ,,,,,,,,,,,,,,,,,,,,,,,,,,,
4,react-dom,The entry point of the DOM-related rendering paths. It is intended to be paired with the isomorphic React,, ,,,,,,,,,,,,,,,,,,,,,,,,,,,
5,d3,A JavaScript visualization library for HTML and SVG.,https://www.bootcdn.cn/d3/, ,,,,,,,,,,,,,,,,,,,,,,,,,,,
6,angular.js,Angular 是一个开发平台。它能帮你更轻松的构建 Web 应用。Angular 集声明式模板、依赖注入、端到端工具和一些最佳实践于一身，为你解决开发方面的各种挑战。Angular 为开发者提升构建 Web、手机或桌面应用的能力。,https://www.bootcdn.cn/angular.js/, ,,,,,,,,,,,,,,,,,,,,,,,,,,,
7,angular-touch,AngularJS module for touch events and helpers for touch-enabled devices,https://www.bootcdn.cn/angular-touch/, ,,,,,,,,,,,,,,,,,,,,,,,,,,,
8,angular-sanitize,AngularJS module for sanitizing HTML,https://www.bootcdn.cn/angular-sanitize/, ,,,,,,,,,,,,,,,,,,,,,,,,,,,
9,angular-resource,AngularJS module for interacting with RESTful server-side data sources,https://www.bootcdn.cn/angular-resource/, ,,,,,,,,,,,,,,,,,,,,,,,,,,,
10,angular-messages,AngularJS module that provides enhanced support for displaying messages within templates,https://www.bootcdn.cn/angular-messages/, ,,,,,,,,,,,,,,,,,,,,,,,,,,,
11,angular-i18n,Locales for AngularJS,https://www.bootcdn.cn/angular-i18n/, ,,,,,,,,,,,,,,,,,,,,,,,,,,,
12,font-awesome,Font Awesome 字体为您提供可缩放矢量图标,, ,,,,,,,,,,,,,,,,,,,,,,,,,,,
13,animate.css,animate.css 包含了一组炫酷、有趣、跨浏览器的动画，可以在你的项目中直接使用。,https://www.bootcdn.cn/animate.css/, ,,,,,,,,,,,,,,,,,,,,,,,,,,,
14,axios,Axios 是一个基于 promise 的 HTTP 库,, ,,,,,,,,,,,,,,,,,,,,,,,,,,,
15,jquery,jQuery 是一个高效、精简并且功能丰富的 JavaScript 工具库。它提供的 API 易于使用且兼容众多浏览器，这让诸如 HTML 文档遍历和操作、事件处理、动画和 Ajax 操作更加简单。,https://www.bootcdn.cn/jquery/, ,,,,,,,,,,,,,,,,,,,,,,,,,,,
16,jquery-compat,JavaScript library for DOM operations,https://www.bootcdn.cn/jquery-compat/, ,,,,,,,,,,,,,,,,,,,,,,,,,,,
17,three.js,JavaScript 3D 工具库。,https://www.bootcdn.cn/three.js/, ,,,,,,,,,,,,,,,,,,,,,,,,,,,
18,redux,Redux 是 JavaScript 状态容器，提供可预测化的状态管理。,https://www.bootcdn.cn/redux/, ,,,,,,,,,,,,,,,,,,,,,,,,,,,
19,socket.io,socket.io 是用于构建实时通讯服务的框架。,https://www.bootcdn.cn/socket.io/, ,,,,,,,,,,,,,,,,,,,,,,,,,,,
20,semantic-ui,Semantic 作为一款开发框架，帮助开发者使用对人类友好的 HTML 语言构建优雅的响应式布局。,https://www.bootcdn.cn/semantic-ui/, ,,,,,,,,,,,,,,,,,,,,,,,,,,,
21,reveal.js,The HTML Presentation Framework,https://www.bootcdn.cn/reveal.js/, ,,,,,,,,,,,,,,,,,,,,,,,,,,,
22,typescript,TypeScript 具有类型系统，且是 JavaScript 的超集。 它可以编译成普通的 JavaScript 代码。,https://www.bootcdn.cn/typescript/, ,,,,,,,,,,,,,,,,,,,,,,,,,,,
23,Chart.js,Chart.js 是一个基于 HTML5 canvas 技术的开源图表绘制工具库。,https://www.bootcdn.cn/Chart.js/, ,,,,,,,,,,,,,,,,,,,,,,,,,,,
24,moment.js,Moment.js 是一个 JavaScript 日期处理类库，用于解析、检验、操作、以及显示日期。,https://www.bootcdn.cn/moment.js/, ,,,,,,,,,,,,,,,,,,,,,,,,,,,
25,antd,一套 UI 涉及语言。,https://www.bootcdn.cn/antd/, ,,,,,,,,,,,,,,,,,,,,,,,,,,,
26,material-design-icons,Material Design icons by Google,https://www.bootcdn.cn/material-design-icons/, ,,,,,,,,,,,,,,,,,,,,,,,,,,,
27,lodash.js,Lodash 是一个具有一致接口、模块化、高性能等特性的 JavaScript 工具库。,https://www.bootcdn.cn/lodash.js/, ,,,,,,,,,,,,,,,,,,,,,,,,,,,
28,ionic,Ionic 是一个强大的 HTML5 应用程序开发框架。,https://www.bootcdn.cn/ionic/, ,,,,,,,,,,,,,,,,,,,,,,,,,,,
29,materialize,Builds Materialize distribution packages,https://www.bootcdn.cn/materialize/, ,,,,,,,,,,,,,,,,,,,,,,,,,,,
30,impress.js,It's a presentation framework based on the power of CSS3 transforms and transitions in modern browsers and inspired by the idea behind prezi.com,https://www.bootcdn.cn/impress.js/, ,,,,,,,,,,,,,,,,,,,,,,,,,,,
31,react-router,A complete routing library for React.js,https://www.bootcdn.cn/react-router/, ,,,,,,,,,,,,,,,,,,,,,,,,,,,
32,react-router-dom,DOM bindings for React Router,https://www.bootcdn.cn/react-router-dom/, ,,,,,,,,,,,,,,,,,,,,,,,,,,,
33,element-ui,Element，一套为开发者、设计师和产品经理准备的基于 Vue 2.0 的桌面端组件库。,https://www.bootcdn.cn/element-ui/, ,,,,,,,,,,,,,,,,,,,,,,,,,,,
34,normalize,Normalize.css as a node packaged module,https://www.bootcdn.cn/normalize/, ,,,,,,,,,,,,,,,,,,,,,,,,,,,
35,bulma,Bulma 是一个基于 Flexbox 布局技术的免费、开源的现代 CSS 框架。,https://www.bootcdn.cn/bulma/, ,,,,,,,,,,,,,,,,,,,,,,,,,,,
36,echarts,ECharts 是一个使用 JavaScript 实现的开源可视化库，可以流畅的运行在 PC 和移动设备上，兼容当前绝大部分浏览器（IE8/9/10/11，Chrome，Firefox，Safari等），底层依赖轻量级的矢量图形库 ZRender，提供直观，交互丰富，可高度个性化定制的数据可视化图表。,https://www.bootcdn.cn/echarts/, ,,,,,,,,,,,,,,,,,,,,,,,,,,,
37,babel-polyfill,Provides polyfills necessary for a full ES2015+ environment,https://www.bootcdn.cn/babel-polyfill/, ,,,,,,,,,,,,,,,,,,,,,,,,,,,
38,babel-core,A compiler for writing next generation JavaScript,https://www.bootcdn.cn/babel-core/, ,,,,,,,,,,,,,,,,,,,,,,,,,,,
39,6to5,Turn ES6 code into readable vanilla ES5 with source maps,https://www.bootcdn.cn/6to5/, ,,,,,,,,,,,,,,,,,,,,,,,,,,,
40,material-design-lite,Material Design Components in CSS,, ,,,,,,,,,,,,,,,,,,,,,,,,,,,
41,gulp,Gulp - 基于流的自动化构建工具。,https://www.bootcdn.cn/gulp/, ,,,,,,,,,,,,,,,,,,,,,,,,,,,
42,blueimp-file-upload,File Upload widget with multiple file selection,, audio and video for jQuery. Supports cross-domain, chunked and resumable file uploads. Works with any server-side platform (Google App Engine, PHP, Python, Ruby on Rails, Java, etc.) that supports standard HTML form file uploads.";"https://www.bootcdn.cn/blueimp-file-upload/",,,,,,,,,,,,,,,,,,,,,
43,foundation,Foundation 是一个支持响应式布局的前端框架。,https://www.bootcdn.cn/foundation/,,,,,,,,,,,,,,,,,,,,,,,,,,,,
44,foundation-essential,The most advanced responsive front-end framework in the world.,https://www.bootcdn.cn/foundation-essential/,,,,,,,,,,,,,,,,,,,,,,,,,,,,
45,backbone.js,Backbone 为复杂 Javascript 应用程序提供模型(models)、集合(collections)、视图(views)的结构。其中模型用于绑定键值数据和自定义事件；集合附有可枚举函数的丰富 API； 视图可以声明事件处理函数，并通过 RESTful JSON 接口连接到应用程序。,https://www.bootcdn.cn/backbone.js/,,,,,,,,,,,,,,,,,,,,,,,,,,,,
46,admin-lte,Admin dashboard and control panel template,https://www.bootcdn.cn/admin-lte/,,,,,,,,,,,,,,,,,,,,,,,,,,,,
47,immutable,Immutable Data Collections,https://www.bootcdn.cn/immutable/,,,,,,,,,,,,,,,,,,,,,,,,,,,,
48,fullPage.js,Create beautiful fullscreen scrolling websites,https://www.bootcdn.cn/fullPage.js/,,,,,,,,,,,,,,,,,,,,,,,,,,,,
49,async,Higher-order functions and common patterns for asynchronous code,https://www.bootcdn.cn/async/,,,,,,,,,,,,,,,,,,,,,,,,,,,,
50,animejs,Polyvalent Javascript animation engine,https://www.bootcdn.cn/animejs/,,,,,,,,,,,,,,,,,,,,,,,,,,,,
51,pdf.js,PDF Reader in JavaScript,https://www.bootcdn.cn/pdf.js/,,,,,,,,,,,,,,,,,,,,,,,,,,,,
52,clipboard.js,clipboard.js 是一个不依赖 Flash,,,,,,,,,,,,,,,,,,,,,,,,,,,,,
53,underscore.js,Underscore 是一个 JavaScript 工具库，它提供了一整套函数式编程的实用功能，但是没有扩展任何 JavaScript 内置对象。,https://www.bootcdn.cn/underscore.js/,,,,,,,,,,,,,,,,,,,,,,,,,,,,
54,leaflet,JavaScript library for mobile-friendly interactive maps,https://www.bootcdn.cn/leaflet/,,,,,,,,,,,,,,,,,,,,,,,,,,,,
55,video.js,Video.js 是一个通用的在网页上嵌入视频播放器的 JS 库，Video.js 自动检测浏览器对 HTML5 的支持情况,,,,,,,,,,,,,,,,,,,,,,,,,,,,,
56,phaser,A fast,,,,,,,,,,,,,,,,,,,,,,,,,,,,,
57,modernizr,Modernizr 是一个 JavaScript 库，用于检测用户浏览器的 HTML5 与 CSS3 特性。,https://www.bootcdn.cn/modernizr/,,,,,,,,,,,,,,,,,,,,,,,,,,,,
58,select2,Select2 is a jQuery based replacement for select boxes. It supports searching,,,,,,,,,,,,,,,,,,,,,,,,,,,,,
59,slick-carousel,the last carousel you'll ever need,https://www.bootcdn.cn/slick-carousel/,,,,,,,,,,,,,,,,,,,,,,,,,,,,
60,chosen,Chosen is a JavaScript plugin that makes select boxes user-friendly. It is currently available in both jQuery and Prototype flavors.,https://www.bootcdn.cn/chosen/,,,,,,,,,,,,,,,,,,,,,,,,,,,,
61,mermaid,Markdownish syntax for generating flowcharts,,,,,,,,,,,,,,,,,,,,,,,,,,,,,
62,pixi.js,Pixi.js 基于 WebGL 开发，是一个超快的 HTML5 2D 渲染引擎。,https://www.bootcdn.cn/pixi.js/,,,,,,,,,,,,,,,,,,,,,,,,,,,,
63,preact,Preact 是 React 的 3kb 轻量化方案，拥有同样的 ES6 API、组件和虚拟 DOM 。,https://www.bootcdn.cn/preact/,,,,,,,,,,,,,,,,,,,,,,,,,,,,
64,styled-components,Visual primitives for the component age. Use the best bits of ES6 and CSS to style your apps without stress,https://www.bootcdn.cn/styled-components/,,,,,,,,,,,,,,,,,,,,,,,,,,,,
65,fetch,fetch 是 window.fetch 的 JavaScript polyfill。全局 fetch 函数是 web 请求和处理响应的简单方式，不使用 XMLHttpRequest。这个 polyfill 编写的接近标准的 Fetch 规范。,https://www.bootcdn.cn/fetch/,,,,,,,,,,,,,,,,,,,,,,,,,,,,
66,weui,WeUI 是一套同微信原生视觉体验一致的基础样式库，由微信官方设计团队为微信 Web 开发量身设计，可以令用户的使用感知更加统一。包含button、cell、dialog、 progress、 toast、article、actionsheet、icon等各式元素。,https://www.bootcdn.cn/weui/,,,,,,,,,,,,,,,,,,,,,,,,,,,,
67,quill,Cross browser rich text editor,https://www.bootcdn.cn/quill/,,,,,,,,,,,,,,,,,,,,,,,,,,,,
68,polymer,The Polymer library makes it easy to create your own web components. Give your element some markup and properties,,,,,,,,,,,,,,,,,,,,,,,,,,,,,
69,hover.css,A collection of CSS3 powered hover effects to be applied to call to actions,,,,,,,,,,,,,,,,,,,,,,,,,,,,,
70,ember.js,Ember.js是一个开源的 JavaScript 客户端框架，用于开发Web应用程序并使用MVC（模型 - 视图 - 控制器）架构模式。,https://www.bootcdn.cn/ember.js/,,,,,,,,,,,,,,,,,,,,,,,,,,,,
71,bootstrap-material-design,基于 Material 风格的 Bootstrap UI 组件库。支持 Bootstrap v3 和 v4 版本。,https://www.bootcdn.cn/bootstrap-material-design/,,,,,,,,,,,,,,,,,,,,,,,,,,,,
72,rxjs,Library for composing asynchronous and event-based operations in JavaScript,https://www.bootcdn.cn/rxjs/,,,,,,,,,,,,,,,,,,,,,,,,,,,,
73,hammer.js,A javascript library for multi-touch gestures,https://www.bootcdn.cn/hammer.js/,,,,,,,,,,,,,,,,,,,,,,,,,,,,
74,pure,Pure.css 是 Yahoo 出品的一组轻量级、响应式纯 CSS 模块，适用于任何 Web 项目。,https://www.bootcdn.cn/pure/,,,,,,,,,,,,,,,,,,,,,,,,,,,,
75,sweetalert,SweetAlert 是一个 JavaScript 插件，能够完美替代 JavaScript 自带的 alert 弹出框，并且功能强大、设计优美。,https://www.bootcdn.cn/sweetalert/,,,,,,,,,,,,,,,,,,,,,,,,,,,,
76,iview,A high quality UI components Library with Vue.js,https://www.bootcdn.cn/iview/,,,,,,,,,,,,,,,,,,,,,,,,,,,,
77,Swiper,Most modern mobile touch slider and framework with hardware accelerated transitions,https://www.bootcdn.cn/Swiper/,,,,,,,,,,,,,,,,,,,,,,,,,,,,
78,web-starter-kit,Google Web Starter Kit: Boilerplate & Tooling for Multi-Device Development,https://www.bootcdn.cn/web-starter-kit/,,,,,,,,,,,,,,,,,,,,,,,,,,,,
79,dragula,Drag and drop so simple it hurts,https://www.bootcdn.cn/dragula/,,,,,,,,,,,,,,,,,,,,,,,,,,,,
80,webtorrent,Streaming torrent client,https://www.bootcdn.cn/webtorrent/,,,,,,,,,,,,,,,,,,,,,,,,,,,,
81,vuex,Vuex 是一个专为 Vue.js 应用程序开发的状态管理模式。,https://www.bootcdn.cn/vuex/,,,,,,,,,,,,,,,,,,,,,,,,,,,,
82,skrollr,Stand-alone parallax scrolling library with zero dependencies.,https://www.bootcdn.cn/skrollr/,,,,,,,,,,,,,,,,,,,,,,,,,,,,
83,marked,A markdown parser built for speed,https://www.bootcdn.cn/marked/,,,,,,,,,,,,,,,,,,,,,,,,,,,,
84,mobx,Simple,,,,,,,,,,,,,,,,,,,,,,,,,,,,,
85,nprogress,Simple slim progress bars,https://www.bootcdn.cn/nprogress/,,,,,,,,,,,,,,,,,,,,,,,,,,,,
86,particles.js,A lightweight JavaScript library for creating particles,https://www.bootcdn.cn/particles.js/,,,,,,,,,,,,,,,,,,,,,,,,,,,,
87,photoswipe,JavaScript gallery,https://www.bootcdn.cn/photoswipe/,,,,,,,,,,,,,,,,,,,,,,,,,,,,
88,bluebird,Full featured Promises/A+ implementation with exceptionally good performance,https://www.bootcdn.cn/bluebird/,,,,,,,,,,,,,,,,,,,,,,,,,,,,
89,jade,A clean,,,,,,,,,,,,,,,,,,,,,,,,,,,,,
90,intro.js,Better introductions for websites and features with a step-by-step guide for your projects,https://www.bootcdn.cn/intro.js/,,,,,,,,,,,,,,,,,,,,,,,,,,,,
91,fastclick,Polyfill to remove click delays on browsers with touch UIs.,https://www.bootcdn.cn/fastclick/,,,,,,,,,,,,,,,,,,,,,,,,,,,,
92,dayjs,2KB immutable date library alternative to Moment.js with the same modern API,https://www.bootcdn.cn/dayjs/,,,,,,,,,,,,,,,,,,,,,,,,,,,,
93,mocha,simple,,,,,,,,,,,,,,,,,,,,,,,,,,,,,
94,scrollReveal.js,Easily reveal elements as they enter the viewport.,https://www.bootcdn.cn/scrollReveal.js/,,,,,,,,,,,,,,,,,,,,,,,,,,,,
95,Faker,Generate massive amounts of fake contextual data,https://www.bootcdn.cn/Faker/,,,,,,,,,,,,,,,,,,,,,,,,,,,,
96,codemirror,In-browser code editing made bearable,https://www.bootcdn.cn/codemirror/,,,,,,,,,,,,,,,,,,,,,,,,,,,,
97,skeleton,Skeleton is a small collection of CSS files that can help you rapidly develop sites that look beautiful at any size,,,,,,,,,,,,,,,,,,,,,,,,,,,,,
98,jquery.pjax,pjax is a jQuery plugin that uses ajax and pushState to deliver a fast browsing experience with real permalinks,,,,,,,,,,,,,,,,,,,,,,,,,,,,,
99,redux-saga,Saga middleware for Redux to handle Side Effects,https://www.bootcdn.cn/redux-saga/,,,,,,,,,,,,,,,,,,,,,,,,,,,,
100,gentelella,Gentellela Admin is a free to use Bootstrap admin template,https://www.bootcdn.cn/gentelella/,,,,,,,,,,,,,,,,,,,,,,,,,,,,
101,hyperapp,1kb JavaScript library for building modern UI applications,https://www.bootcdn.cn/hyperapp/,,,,,,,,,,,,,,,,,,,,,,,,,,,,
102,less.js,Leaner CSS,https://www.bootcdn.cn/less.js/,,,,,,,,,,,,,,,,,,,,,,,,,,,,
103,flux,An application architecture based on a unidirectional data flow,https://www.bootcdn.cn/flux/,,,,,,,,,,,,,,,,,,,,,,,,,,,,
104,popmotion,The JavaScript motion engine. Handles animation,,,,,,,,,,,,,,,,,,,,,,,,,,,,,
105,react-motion,A spring that solves your animation problems.,https://www.bootcdn.cn/react-motion/,,,,,,,,,,,,,,,,,,,,,,,,,,,,
106,spinkit,A collection of loading indicators animated with CSS,https://www.bootcdn.cn/spinkit/,,,,,,,,,,,,,,,,,,,,,,,,,,,,
107,velocity,Accelerated JavaScript animation.,https://www.bootcdn.cn/velocity/,,,,,,,,,,,,,,,,,,,,,,,,,,,,
108,date-fns,Modern JavaScript date utility library,https://www.bootcdn.cn/date-fns/,,,,,,,,,,,,,,,,,,,,,,,,,,,,
109,typeahead.js,fast and fully-featured autocomplete library,https://www.bootcdn.cn/typeahead.js/,,,,,,,,,,,,,,,,,,,,,,,,,,,,
110,vuetify,Vue.js 2 Semantic Component Framework,https://www.bootcdn.cn/vuetify/,,,,,,,,,,,,,,,,,,,,,,,,,,,,
111,jspdf,PDF Document creation from JavaScript,https://www.bootcdn.cn/jspdf/,,,,,,,,,,,,,,,,,,,,,,,,,,,,
112,react-redux,Official React bindings for Redux,https://www.bootcdn.cn/react-redux/,,,,,,,,,,,,,,,,,,,,,,,,,,,,
113,Sortable,Minimalist JavaScript library for reorderable drag-and-drop lists on modern browsers and touch devices. No jQuery. Supports AngularJS and any CSS library,,,,,,,,,,,,,,,,,,,,,,,,,,,,,
114,coffee-script,Unfancy JavaScript,https://www.bootcdn.cn/coffee-script/,,,,,,,,,,,,,,,,,,,,,,,,,,,,
115,react-select,A Select control built with and for ReactJS,https://www.bootcdn.cn/react-select/,,,,,,,,,,,,,,,,,,,,,,,,,,,,
116,ramda,A practical functional library for JavaScript programmers.,https://www.bootcdn.cn/ramda/,,,,,,,,,,,,,,,,,,,,,,,,,,,,
117,feather-icons,简洁、美观、开源的图标库。,https://www.bootcdn.cn/feather-icons/,,,,,,,,,,,,,,,,,,,,,,,,,,,,
118,ant-design-pro,An enterprise-class UI design language and React-based implementation,https://www.bootcdn.cn/ant-design-pro/,,,,,,,,,,,,,,,,,,,,,,,,,,,,
119,angular-ui-bootstrap,Native AngularJS (Angular) directives for Bootstrap. Small footprint (5kB gzipped!),,,,,,,,,,,,,,,,,,,,,,,,,,,,,
120,tesseract.js,Pure Javascript Multilingual OCR,https://www.bootcdn.cn/tesseract.js/,,,,,,,,,,,,,,,,,,,,,,,,,,,,
121,html2canvas,Screenshots with JavaScript,https://www.bootcdn.cn/html2canvas/,,,,,,,,,,,,,,,,,,,,,,,,,,,,
122,bodymovin,After Effects plugin for exporting animations to SVG + JavaScript or canvas + JavaScript,https://www.bootcdn.cn/bodymovin/,,,,,,,,,,,,,,,,,,,,,,,,,,,,
123,draft-js,A React framework for building text editors.,https://www.bootcdn.cn/draft-js/,,,,,,,,,,,,,,,,,,,,,,,,,,,,
124,q.js,A library for promises (CommonJS/Promises/A,,,,,,,,,,,,,,,,,,,,,,,,,,,,,
125,react-bootstrap,Bootstrap 3 components built with React,https://www.bootcdn.cn/react-bootstrap/,,,,,,,,,,,,,,,,,,,,,,,,,,,,
126,ratchet,Build mobile apps with simple HTML,,,,,,,,,,,,,,,,,,,,,,,,,,,,,
127,flat-ui,Flat UI Free is a beautiful theme for Bootstrap. We have redesigned many of its components to look flat in every pixel,https://www.bootcdn.cn/flat-ui/,,,,,,,,,,,,,,,,,,,,,,,,,,,,
128,mo-js,motion graphics toolbelt for the web,https://www.bootcdn.cn/mo-js/,,,,,,,,,,,,,,,,,,,,,,,,,,,,
129,zepto,Zepto 是一个轻量级的针对现代高级浏览器的 JavaScript 库， 它与 jQuery 有着类似的 API。 如果你会用 jQuery，那么你也会用 Zepto。,https://www.bootcdn.cn/zepto/,,,,,,,,,,,,,,,,,,,,,,,,,,,,
130,react-native-elements,React Native Elements & UI Toolkit,https://www.bootcdn.cn/react-native-elements/,,,,,,,,,,,,,,,,,,,,,,,,,,,,
131,localforage,Offline storage,,,,,,,,,,,,,,,,,,,,,,,,,,,,,
132,pace,Pace 是一个页面加载进度条工具。,https://www.bootcdn.cn/pace/,,,,,,,,,,,,,,,,,,,,,,,,,,,,
133,dropzone,Dropzone -- 处理文件拖拽上传。,https://www.bootcdn.cn/dropzone/,,,,,,,,,,,,,,,,,,,,,,,,,,,,
134,jasmine,Official packaging of Jasmine's core files for use by Node.js projects.,https://www.bootcdn.cn/jasmine/,,,,,,,,,,,,,,,,,,,,,,,,,,,,
135,handlebars.js,Handlebars 是一个 JavaScript 语义模板库，通过对视图（view）和数据的分离来快速构建 Web 模板。,https://www.bootcdn.cn/handlebars.js/,,,,,,,,,,,,,,,,,,,,,,,,,,,,
136,angular-ui-router,State-based routing for AngularJS,https://www.bootcdn.cn/angular-ui-router/,,,,,,,,,,,,,,,,,,,,,,,,,,,,
137,xlsx,Excel (XLSB/XLSX/XLSM/XLS/XML) and ODS spreadsheet parser and writer,https://www.bootcdn.cn/xlsx/,,,,,,,,,,,,,,,,,,,,,,,,,,,,
138,flv.js,HTML5 FLV Player,https://www.bootcdn.cn/flv.js/,,,,,,,,,,,,,,,,,,,,,,,,,,,,
139,masonry,Masonry -- 一个瀑布流布局工具库。,https://www.bootcdn.cn/masonry/,,,,,,,,,,,,,,,,,,,,,,,,,,,,
140,superagent,elegant & feature rich browser / node HTTP with a fluent API,https://www.bootcdn.cn/superagent/,,,,,,,,,,,,,,,,,,,,,,,,,,,,
141,swagger-ui,Swagger UI is a dependency-free collection of HTML,,,,,,,,,,,,,,,,,,,,,,,,,,,,,
142,uikit,UIkit 是 YOOtheme 团队开发的一款轻量级、模块化的前端框架，可快速构建强大的前端 WEB 界面。,https://www.bootcdn.cn/uikit/,,,,,,,,,,,,,,,,,,,,,,,,,,,,
143,react-virtualized,React components for efficiently rendering large,,,,,,,,,,,,,,,,,,,,,,,,,,,,,
144,parallax,Parallax Engine that reacts to the orientation of a smart device.,https://www.bootcdn.cn/parallax/,,,,,,,,,,,,,,,,,,,,,,,,,,,,
145,framework7,Framework7 是一个开源免费的框架，可以用来开发混合移动应用（原生和 HTML 混合）或者开发 iOS & Android 风格的 WEB APP。也可以用来作为原型开发工具，可以迅速创建一个应用的原型。,https://www.bootcdn.cn/framework7/,,,,,,,,,,,,,,,,,,,,,,,,,,,,
146,reselect,Selectors for Redux.,https://www.bootcdn.cn/reselect/,,,,,,,,,,,,,,,,,,,,,,,,,,,,
147,highlight.js,Syntax highlighting with language autodetection.,https://www.bootcdn.cn/highlight.js/,,,,,,,,,,,,,,,,,,,,,,,,,,,,
148,riot,A React-like user interface micro-library,https://www.bootcdn.cn/riot/,,,,,,,,,,,,,,,,,,,,,,,,,,,,
149,inferno,An extremely fast,,,,,,,,,,,,,,,,,,,,,,,,,,,,,
150,inferno-vnode-flags,Provides an enum of all possible VNode Flags used when calling Inferno.createVNode,https://www.bootcdn.cn/inferno-vnode-flags/,,,,,,,,,,,,,,,,,,,,,,,,,,,,
151,inferno-test-utils,Suite of utilities for testing Inferno applications,https://www.bootcdn.cn/inferno-test-utils/,,,,,,,,,,,,,,,,,,,,,,,,,,,,
152,inferno-shared,Helpers functions for Inferno,https://www.bootcdn.cn/inferno-shared/,,,,,,,,,,,,,,,,,,,,,,,,,,,,
153,inferno-server,Provides methods to render HTML strings from Inferno elements,https://www.bootcdn.cn/inferno-server/,,,,,,,,,,,,,,,,,,,,,,,,,,,,
154,inferno-router,Provides routing functionality for Inferno,https://www.bootcdn.cn/inferno-router/,,,,,,,,,,,,,,,,,,,,,,,,,,,,
155,inferno-redux,Official Inferno bindings for Redux,https://www.bootcdn.cn/inferno-redux/,,,,,,,,,,,,,,,,,,,,,,,,,,,,
156,inferno-mobx,Official Inferno bindings for Mobx,https://www.bootcdn.cn/inferno-mobx/,,,,,,,,,,,,,,,,,,,,,,,,,,,,
157,inferno-hyperscript,Bridging hyperscript to InfernoJS,https://www.bootcdn.cn/inferno-hyperscript/,,,,,,,,,,,,,,,,,,,,,,,,,,,,
158,inferno-devtools,Provides support for React's Dev Tools for Inferno,https://www.bootcdn.cn/inferno-devtools/,,,,,,,,,,,,,,,,,,,,,,,,,,,,
159,inferno-create-element,Provides methods to create Inferno VNodes,https://www.bootcdn.cn/inferno-create-element/,,,,,,,,,,,,,,,,,,,,,,,,,,,,
160,inferno-create-class,Provides a helper to create Inferno Components without needing ES2015,https://www.bootcdn.cn/inferno-create-class/,,,,,,,,,,,,,,,,,,,,,,,,,,,,
161,inferno-component,Provides ES2015 stateful components (with lifecycle events) to Inferno,https://www.bootcdn.cn/inferno-component/,,,,,,,,,,,,,,,,,,,,,,,,,,,,
162,inferno-compat,Provides a compatibility with React codebases,https://www.bootcdn.cn/inferno-compat/,,,,,,,,,,,,,,,,,,,,,,,,,,,,
163,ionicons,The premium icon font for Ionic Framework,https://www.bootcdn.cn/ionicons/,,,,,,,,,,,,,,,,,,,,,,,,,,,,
164,iris-ws,Client side library for the Websocket package used in the golang web framework called IRIS.,https://www.bootcdn.cn/iris-ws/,,,,,,,,,,,,,,,,,,,,,,,,,,,,
165,mint-ui,Mobile UI elements for vue.js,https://www.bootcdn.cn/mint-ui/,,,,,,,,,,,,,,,,,,,,,,,,,,,,
166,recompose,A React utility belt for function components and higher-order components,https://www.bootcdn.cn/recompose/,,,,,,,,,,,,,,,,,,,,,,,,,,,,
167,medium-editor,Medium.com WYSIWYG editor clone.,https://www.bootcdn.cn/medium-editor/,,,,,,,,,,,,,,,,,,,,,,,,,,,,
168,howler,Javascript audio library for the modern web.,https://www.bootcdn.cn/howler/,,,,,,,,,,,,,,,,,,,,,,,,,,,,
169,trix,A rich text editor for everyday writing,https://www.bootcdn.cn/trix/,,,,,,,,,,,,,,,,,,,,,,,,,,,,
170,mustache.js,Logic-less {{mustache}} templates with JavaScript,https://www.bootcdn.cn/mustache.js/,,,,,,,,,,,,,,,,,,,,,,,,,,,,
171,plyr,A simple,,,,,,,,,,,,,,,,,,,,,,,,,,,,,
172,monaco-editor,A browser based code editor,https://www.bootcdn.cn/monaco-editor/,,,,,,,,,,,,,,,,,,,,,,,,,,,,
173,amazeui,Sleek,,,,,,,,,,,,,,,,,,,,,,,,,,,,,
174,draggable,The JavaScript Drag & Drop library your grandparents warned you about.,https://www.bootcdn.cn/draggable/,,,,,,,,,,,,,,,,,,,,,,,,,,,,
175,vue-router,A router for Vue.js,https://www.bootcdn.cn/vue-router/,,,,,,,,,,,,,,,,,,,,,,,,,,,,
176,validator,String validation and sanitization,https://www.bootcdn.cn/validator/,,,,,,,,,,,,,,,,,,,,,,,,,,,,
177,store.js,A localStorage wrapper for all browsers without using cookies or flash. Uses localStorage,,,,,,,,,,,,,,,,,,,,,,,,,,,,,
178,frappe-charts,Simple,,,,,,,,,,,,,,,,,,,,,,,,,,,,,
179,require.js,RequireJS 是一个 JavaScript 文件和模块载入工具。它针对浏览器使用场景进行了优化，并且也可以应用到其他 JavaScript 环境中，例如 Rhino 和 Node.js。,https://www.bootcdn.cn/require.js/,,,,,,,,,,,,,,,,,,,,,,,,,,,,
180,react-relay,A framework for building data-driven React applications.,https://www.bootcdn.cn/react-relay/,,,,,,,,,,,,,,,,,,,,,,,,,,,,
181,snap.svg,JavaScript Vector Library,https://www.bootcdn.cn/snap.svg/,,,,,,,,,,,,,,,,,,,,,,,,,,,,
182,hack-font,A typeface designed for source code,https://www.bootcdn.cn/hack-font/,,,,,,,,,,,,,,,,,,,,,,,,,,,,
183,iScroll,Smooth scrolling for the web,https://www.bootcdn.cn/iScroll/,,,,,,,,,,,,,,,,,,,,,,,,,,,,
